He said he feels that you are   not prepared to be president, 8273, 8285
Can you   lay out for us and for him what you do on a daily basis? How does your  ? , 8285, 8305
OK, 8305, 8306
Well  , 8306, 8307
  , 8307, 8307
 " about whats going on "  and domestic affairs, 8307, 8316
", 8316, 8317
Sure, 8317, 8318
Well youve been asking me a lot of questions for a lot of times, 8318, 8332
Ive turned out to be right, 8332, 8338
I turned out to be right on NATO, 8338, 8346
After I said that on NATO NATO changed their whole program because of me." "Excuse me Katy Hillary Clinton said yesterday shes going to start renegotiating trade deals, 8346, 8374
She never said that in her life, 8374, 8381
She said it yesterday only because of me, 8381, 8389
Im the one thats prepared, 8389, 8394
President Obama when he became president he didnt know anything, 8394, 8404
This guy didnt know a thing, 8404, 8410
And honestly today he knows less, 8410, 8416
Today he knows less." "Hes done a terrible job, 8416, 8425
I think Im very prepared." "Now with that being said Ive been a businessman all my life but Ive been watching it, 8425, 8447
Ive been seeing it, 8447, 8451
Ive been feeling, 8451, 8454
And as you know Ive been very much involved in politics from the other side, 8454, 8469
I understand politics or I guess I wouldnt be here, 8469, 8479
I mean I beat a lot of very talented people." , 8479, 8489
  advisers though? ", 8489, 8492
I do, 8492, 8494
I have great foreign advisers, 8494, 8499
And you have a list, 8499, 8504
And I gave you a list, 8504, 8510
And the other day as an example General Quinn and General Flynn and we have so many—we have so many, 8510, 8530
As an example I had a meeting three or four days ago and Im going to do a report on it with seven or eight very very talented advisers." Now with all of that being said a lot of people want the people that are doing it now; people that have certain names, 8530, 8583
Look at the mess theyve gotten us into, 8583, 8591
They said "Have you spoken to so and so?" Well I said but he was in favor of the war in Iraq many years ago which I was not in favor of, 8591, 8623
"Have you spoken to this one or that one?" I said they were all—look at the job theyve done, 8623, 8642
So a lot of the people that you think are good because you know their name or because you see them on television I dont think are good, 8642, 8670
Because look at the end result, 8670, 8676
The end result is our country is a mess, 8676, 8685
The Middle East has never been worse, 8685, 8692
Had we done nothing with the Middle East; had our presidents with an "S" gone to the beach and relaxed wed be in better shape than we are right now, 8692, 8722
All right Tom, 8722, 8725
A couple more, 8725, 8728
Go ahead Tom, 8728, 8731
 " security briefings, 8731, 8734
Youre about to get one." , 8734, 8739
Yeah, 8739, 8740
Do you expect your opinion on   or your opinion on  , 8740, 8750
", 8750, 8751
Well well have to see, 8751, 8756
I mean thats my opinion, 8756, 8761
Thats my opinion, 8761, 8764
Well have to see, 8764, 8768
I have a real problem when Hillary Clinton who gives open access to a phony server is allowed to get these briefings, 8768, 8790
How does Hillary Clinton get a national security briefing when shes been probably hacked when so much of her information the director of the FBI said it was essentially negligent, 8790, 8820
It was negligent." "Now why are they giving her briefings why are these people with great knowledge of the inner workings of our country and our security why are they giving Hillary Clinton briefings? Because its going to get revealed, 8820, 8860
I mean her number one person Huma Abedin is married to Anthony Weiner whos a sleazeball and a pervert, 8860, 8879
And Im not saying that I mean thats recorded history right?" "I dont like Huma going home at night and telling Anthony Weiner all of these secrets OK? So how can Hillary Clinton be briefed on this unbelievably delicate information when it was just proven that she lied and that her server shouldnt have had it and that theyre missing 33000 e-mails and thats just the beginning, 8879, 8946
So I dont think that I know at some point theyre going to be calling theyre going to want to brief me but Im not a talker about this stuff." "I dont think that its safe to have Hillary Clinton in light of what just happened and in light of what we just found out I dont think its safe to have Hillary Clinton be briefed on national security because the word will get out." , 8946, 9021
  ", 9021, 9022
No, 9022, 9023
Hes not going to run for mayor, 9023, 9030
Oh Don? Hes not going to run for mayor, 9030, 9039
Don has no attention of running for mayor, 9039, 9047
But he did a great job the other night with his speech, 9047, 9059
Because he made a good speech everyone says he should run for mayor, 9059, 9072
You know why? Because we have a Democratic mayor whos horrible hes doing a horrible job de Blasio, 9072, 9090
But Don is not going to run for—he has no interest in running for mayor." , 9090, 9105
  , 9105, 9105
Yes, 9105, 9106
 , 9106, 9106
  ", 9106, 9107
Unbelievable what he said, 9107, 9111
I think its disgraceful, 9111, 9115
Hillary Clinton because of me said that TPP is not going to happen, 9115, 9128
But we all know it is going to happen if she won, 9128, 9140
Terry McAuliffe said with a wink that if Hillary gets in shes lying and it will happen, 9140, 9157
And there is nobody closer I know this for a fact there is nobody including her own husband closer to Hillary Clinton than Terry McAuliffe OK? Go ahead." , 9157, 9185
  ", 9185, 9186
Oh I dont know what he said Jon I really—Anthony Weiners—look look look—Anthony Weiner is a proven loser, 9186, 9204
I mean the poor guy hes locked up in a room, 9204, 9215
They lock him up in a room they dont let him out, 9215, 9227
I dont know what Anthony—my son doesnt want to run for mayor, 9227, 9239
He has no intention of running for mayor." "And besides that as a Republican you have a very tiny sliver in Manhattan as you know and in that area, 9239, 9268
Its almost impossible for a Republican to win, 9268, 9276
So and my son likes to win but my son has no intention of running for mayor so lets just put that to bed, 9276, 9300
Go ahead." , 9300, 9302
  , 9302, 9302
Yes in   very sad, 9302, 9306
Not  , 9306, 9307
  ", 9307, 9308
Yes Im looking at it, 9308, 9313
I actually want to find out what causes it, 9313, 9322
Its a problem in many areas OK? Yes go ahead." , 9322, 9332
  , 9332, 9332
Well they shouted—you know what was interesting, 9332, 9339
Yesterday I made a speech in front of the great veterans as you saw and it was very well received she was there the day before, 9339, 9365
And when I started talking about Hillary Clinton the veterans who saw her 24 hours before started screaming "Lock her up! Lock her up! Lock her up." They also screamed that as you know during the speech I made, 9365, 9404
The big speech, 9404, 9407
And I said "Dont do that." Now I didnt do that for any reason, 9407, 9421
I really—I didnt like it, 9421, 9426
And they stopped, 9426, 9429
Not one reporter said that I said that, 9429, 9437
They all said—they started screaming "Lock her up! Lock her up." I said "Dont do that." Nobody reported that I said that because its dishonest reporting, 9437, 9463
You do agree I said that right? , 9463, 9470
You did say that, 9470, 9474
", 9474, 9475
OK, 9475, 9476
Well why didnt somebody report that?" ", 9476, 9483
Thats what I want to ask you about you said you..." ", 9483, 9495
No I think its—I think its a shame that they said it but a lot of people would say that should happen." "OK one more question yes—yes maam go ahead." , 9495, 9525
Yes three weeks is a long time to wait for that   immigration, 9525, 9537
This is Doral it was built by.., 9537, 9544
", 9544, 9545
Well Doral is great, 9545, 9549
And Doral—I think I have over 1000 Hispanics working at Doral and theyre doing a great job." "Yes maam in the yellow go ahead, 9549, 9573
Yellow." , 9573, 9574
I have another question, 9574, 9578
Excuse me, 9578, 9580
Yellow, 9580, 9581
", 9581, 9582
Hillary Clintons running mate..." , 9582, 9586
Who? ", 9586, 9588
Hillary Clintons running mate speaks Spanish, 9588, 9594
Do you think this "  an advantage on.., 9594, 9602
", 9602, 9603
No I dont think it has any impact, 9603, 9611
Hes been very bad—her running mate has been very very bad on employment, 9611, 9624
And all you have to do is go to Virginia and speak to the people of Virginia he has been so bad." "I figured when she chose him he was very popular in Virginia, 9624, 9658
They dont like him, 9658, 9662
They dont like him, 9662, 9666
It has been very close races and his polling is very bad." "So ladies and gentlemen thank you very much, 9666, 9686
I think its time for Hillary Clinton to do a news conference because its almost a year now and it would be interesting to see how she does." Thank you all very much, 9686, 9719
  running for the president  ? , 9719, 9724
Might as well tell him to have a good time, 9724, 9734
He has done one bad job, 9734, 9740
OK thank you everybody, 9740, 9744


