Well theyre united now in a true sense, 4203, 4211
Theyve never been closer." "Theyre selling oil to China, 4211, 4220
We forced them into this position."   , 4220, 4226
No wait a minute, 4226, 4230
  ", 4230, 4231
No Im not going to be an adversary, 4231, 4239
No not at all, 4239, 4243
I have tenants from China, 4243, 4248
I have the biggest bank in the world from China paying me rent, 4248, 4261
I mean I have great relationships with China, 4261, 4269
Im not blaming China for getting away with murder, 4269, 4278
Im blaming our leadership is incompetent, 4278, 4284
We dont know what were doing." "I dont blame—I respect China, 4284, 4295
Hey if China can get away with trade deficits every year of hundreds of billions of dollars—if they can get away with that my hats off to them." I have no problem with China, 4295, 4329
I have a problem with our incompetent leadership allowing that to happen, 4329, 4341
And I believe that Hillary Clinton is even more bought and paid for than Barack Obama, 4341, 4357
I think it will get worse, 4357, 4363
"Its going to be four more years of Obama which is unacceptable to a lot of people you see that, 4363, 4383
But I believe that Hillary Clinton will be worse than Obama." Yes? , 4383, 4395
  you mentioned that you wanted to make college education more affordable, 4395, 4406
", 4406, 4407
Thats right." , 4407, 4409
Working on a plan.., 4409, 4413
", 4413, 4414
Thats right Im going to be doing something over the next four weeks very much so." , 4414, 4430
Are you prepared to give us any sort of.., 4430, 4439
", 4439, 4440
No Im prepared to say were gonna have a great plan, 4440, 4451
One of the things I think because Ive traveled all over the country and Im going—you know where Im going I guess you all know I dont have to say." "But Im going to Toledo and Im going to different places today and Ive met so many people, 4451, 4499
This is such a great country these are such great people, 4499, 4510
one of the saddest things I see are college students that work so hard that go to colleges good colleges theyre good students they do a great job." "Number one they get out they have no jobs, 4510, 4547
Because our jobs are going to Mexico theyre going to China theyre going to Japan theyre going all over the place, 4547, 4568
Theyre not coming here, 4568, 4572
Just like my friend who builds the plants but he doesnt build them here much." "And the saddest thing I see is these students are leveraged debt up to their—up to their neck, 4572, 4605
They cant breathe theyre scared theyre so scared they have leveraged their entire life, 4605, 4619
They have loans." And I have to tell you the colleges are viewing the students as just a con to it, 4619, 4640
Because the students get government money passes through but the number gets higher and higher, 4640, 4655
"Because college costs are out of control because the colleges say what difference does it make? If you take a look at the salaries being paid you take a look at whats going on with the colleges." "Because all of this is a pass through and the students are a con to it, 4655, 4708
So the colleges are costing so much money, 4708, 4716
We are going to help the students, 4716, 4723
Maybe that doesnt fit beautifully within the Republican framework." "But I told this during various times to lots of different people and nobody has a problem with it, 4723, 4751
We have to help our students, 4751, 4757
Our students are under tremendous pressure to a point where its making them sick." "Our students are under tremendous pressure we have to help our students, 4757, 4783
And Im going to have a plan over the next four weeks."   , 4783, 4795
  talking about possibly.., 4795, 4798
", 4798, 4799
Everythings on the table youll see, 4799, 4805
Everything—its a very important—its a very important subject." "Yes maam?" , 4805, 4815
Mr, 4815, 4816
Trump  , 4816, 4817
", 4817, 4818
I think my message is resonating because they have confidence on me at the border if they dont want people pouring into our country, 4818, 4842
Likewise they have confidence with me on ISIS not only in terms of getting rid of them but also in terms of keeping them out of our country because I will not have people come into our country who want to do damage to our people." "I think they have a lot of confidence in terms of my bringing back jobs because I see Carrier and I see Ford and I see all of these companies leaving and going to Mexico like theres nothing to it, 4842, 4928
And then they make their product they sell it back to the United States no tax no nothing we get nothing except unemployment." "And I think people see that, 4928, 4957
I can tell you I mean Im like a pollster myself when Im in front of these massive audiences one of the things that gets constantly—you people know because youre there—the biggest applause is a repeal and replacement of Obamacare." "Because Obamacare is a disaster, 4957, 5002
In Texas going through BlueCross/BlueShield they just announced a 60 percent increase, 5002, 5014
On November 1st youre going to have new numbers come out for Obamacare having to do with increases, 5014, 5032
President Obama is trying to get it moved to December, 5032, 5042
Because it is election-defying, 5042, 5046
It is going to be a massive number the biggest number ever in our countrys history for health care, 5046, 5065
Its going to be announced on November 1st." "I just asked the press dont let him do that, 5065, 5083
Obamacare is a disaster people are dying with it, 5083, 5092
Its a disaster and everybody knows and its going to fold anyway." "In 17 unfortunately—if Im president—I mean Ive got to take over this mess, 5092, 5117
Its going to fold anyway, 5117, 5122
But repeal and replace Obamacare people like it." "They like the fact that Im going to protect the Second Amendment they like the fact that Im going to rebuild our military which is very depleted, 5122, 5157
Those are the things that are resonating." "And they dont feel Hillary Clinton can do it." John go ahead John, 5157, 5177
 " Russia has no business in you—that you dont have any..." , 5177, 5188
No I have nothing to do with Russia John, 5188, 5197
How many times do I have say that? Are you a smart man? I have nothing to with Russia I have nothing to do with Russia, 5197, 5223
And even—for anything, 5223, 5226
What do I have to do with Russia? You know the closest I came to Russia I bought a house a number of years ago in Palm Beach Florida, 5226, 5255
Palm Beach is a very expensive place, 5255, 5262
There was a man who went bankrupt and I bought the house for $40 million and I sold it to a Russian for $100 million including brokerage commissions, 5262, 5290
So I sold it, 5290, 5294
So I bought it for 40 I told it for 100 to a Russian, 5294, 5308
That was a number of years ago, 5308, 5315
I guess probably I sell condos to Russians OK? , 5315, 5324
  ", 5324, 5325
Of course I can, 5325, 5329
I told you other than normal stuff—I buy a house if I sold it to a Russian, 5329, 5346
I have nothing to do with Russia, 5346, 5353
I said that Putin has much better leadership qualities than Obama but who doesnt know that?" , 5353, 5369
  , 5369, 5369
Of course not, 5369, 5372
I own the Trump organization, 5372, 5377
Zero zero, 5377, 5379
Go ahead, 5379, 5381
  , 5381, 5381
I am, 5381, 5383
  , 5383, 5383
I did, 5383, 5385
  ", 5385, 5386
I did, 5386, 5388
Because I would love to see a woman become president of the United States, 5388, 5402
But she would be so wrong, 5402, 5408
And even women say that, 5408, 5413
Women dont like her, 5413, 5417
She would be so wrong, 5417, 5422
Look Hillary Clinton is a disaster, 5422, 5428
Shes been a disaster, 5428, 5432
And even the story told by her husband last night he left out the most interesting chapter, 5432, 5449
I wont get into that." "The chapter that I really waited for because it was pretty boring the chapter that I waited for I never heard, 5449, 5475
And he left it out, 5475, 5480
Look Hillary Clintons a disaster, 5480, 5485
Id love to see a woman become president and itll happen absolutely, 5485, 5497
But I think it would be bad for women if it were Hillary Clinton, 5497, 5511
Yes maam?" , 5511, 5513
  , 5513, 5513
Yes I do, 5513, 5516
  ", 5516, 5517
But I have spoken to about many times and I speak about it all the time and the police have to be very careful they have to be very very well trained, 5517, 5549
I speak about it all the time in fact I mentioned the most recent death excuse me I mentioned the most recent deaths in Louisiana and in Minnesota, 5549, 5577
I speak about it all the time, 5577, 5584
Its a real problem because if the police do 100000 great jobs and they have one either a rogue policeman or a cop who was poorly trained or did a bad job you see that incident on television for weeks, 5584, 5624
Its a real problem." "You dont see the good work that they do but if they make one mistake out of 100000 out of more than that its on television night after night after night, 5624, 5659
The police in this country do an amazing job but likewise I agree and I do mention that all the time, 5659, 5680
Yes maam go ahead." , 5680, 5684
  , 5684, 5684
Oh go ahead go ahead, 5684, 5689
  , 5689, 5689
Yes, 5689, 5690
  ", 5690, 5691
No but they seem to be if its Russians, 5691, 5700
I have no idea, 5700, 5704
Its probably not Russia, 5704, 5708
Nobody knows if its Russia, 5708, 5713
You know the sad thing is? That with the technology and the genius we have in this country not in government unfortunately but with the genius we have in government we dont even know who took the Democratic National Committee e-mails, 5713, 5754
We dont even know who it is." "I heard this morning one report said they dont think its Russia they think it might be China, 5754, 5779
Another report said it might be just a hacker some guy with a 200 I.Q, 5779, 5794
that cant get up in the morning OK? Nobody knows, 5794, 5804
Honestly they have no idea if its Russia, 5804, 5812
Might be Russia, 5812, 5815
But if its any foreign country it shows how little respect they have for the United States, 5815, 5832
Yes maam." , 5832, 5834
  , 5834, 5834
Yes, 5834, 5835
  ", 5835, 5836
Well and the biggest thing is number one we have to stop by keeping people out because these people theyve got something bad going on up there, 5836, 5863
Thats something really bad going on, 5863, 5869
And then people in terms of Islam and radical Islamic terrorism a term that our president refuses to use I cant hes still not using it, 5869, 5895
Hes still not using it, 5895, 5900
And she doesnt want to use it other than I forced her into maybe using it, 5900, 5916
She said she will use it but so far she didnt." "Shell probably use it tonight, 5916, 5932
Like the American flags as soon as we put out a thing they ran a couple of American flags up in the stage it was a disgrace, 5932, 5959
You had a room with a massive stage without flags, 5959, 5969
I think this—I think that the people in the community know whats going on, 5969, 5983
Whether its in a mosque or whether its in the community and they have to report these people, 5983, 6001
When you look at San Bernardino people knew—many people knew what was going on, 6001, 6015
They had bombs lying all over the floor, 6015, 6023
They had bombs on the floor, 6023, 6029
I mean this isnt—you walk into somebodys house there are bombs lying on the floor—I think theres a problem there, 6029, 6049
You got to report it." And by the way David Hinckley should not have been freed OK? David Hinckley was just released—John Hinckley—I think that John Hinckley—excuse me John Hinckley should not have been freed, 6049, 6084
I just heard about it, 6084, 6089
  ", 6089, 6090
Do you have any pause about asking a foreign government—Russia China anybody—to interfere to hack into the system of anybodys in this country..." ", 6090, 6114
Thats up to the President, 6114, 6119
Let the President talk to them, 6119, 6125
Look heres the problem, 6125, 6129
Heres the problem Katy, 6129, 6133
Katy heres the problem very simple, 6133, 6139
He has no respect..." , 6139, 6143
  30000 e-mails.., 6143, 6145
", 6145, 6146
Well they probably have them, 6146, 6151
Id like to have them released." , 6151, 6157
Does that not give you pause? ", 6157, 6164
No it gives me no pause, 6164, 6170
If they have them they have them, 6170, 6177
We might as well—hey you know what gives me more pause? That a person in our government crooked Hillary Clinton—heres what gives me pause, 6177, 6201
Be quiet, 6201, 6203
I know you want to save her, 6203, 6210
That a person in our government Katy would delete or get rid of 33000 e- mails, 6210, 6226
That gives me a big problem, 6226, 6232
After she gets a subpoena! She gets subpoenaed and she gets rid of 33000 e-mails? That gives me a problem, 6232, 6252
Now if Russia or China or any other country has those e-mails I mean to be honest with you Id love to see them."   , 6252, 6276
A question about Mike Pence because "The New York Times" reported that  " conversation with John Kasichs campaign "  says you can be the most powerful  .., 6276, 6303
", 6303, 6304
Thats the most ridiculous conversation, 6304, 6309
He never had the—Don Jr, 6309, 6314
told me—let me just tell you, 6314, 6320
Let me save you a lot of boredom." , 6320, 6328
 " Mike Pences role as vice president if you are elected?" ", 6328, 6340
Mike Pence will play a big role but I just want to tell you about John Kasich, 6340, 6357
I never spoke to him about being vice president, 6357, 6366
We dont have good chemistry together, 6366, 6372
I have never spoken to him about being vice president, 6372, 6382
I would never pick him to be vice president, 6382, 6391
There was never a conversation and he has a habit of doing things like this where he says things that may be a little bit shaky, 6391, 6417
He never spoke—Don Jr, 6417, 6421
would never—and that was so long ago I didnt even know I was going to get the nomination at that point, 6421, 6442
Just so you understand I would not have picked John Kasich wouldnt be the right guy, 6442, 6458
I mean for that to have gotten out that was so ridiculous, 6458, 6470
And then I was going to put him in charge of national and worldwide policy, 6470, 6485
So whats left for the president? I think you know me better than that, 6485, 6499
That was put out by him, 6499, 6505
Hes a nice man John Kasich hes fine, 6505, 6513
Hes fine, 6513, 6515
I would never have chosen him." Now I did speak to various people and I actually got acceptances from many people, 6515, 6536
There are some people that called me that very much wanted to be vice president but I picked a man that I have a lot of respect for and Mike Pence is doing a great job, 6536, 6572
"Let me just explain—I never asked John Kasich to be vice president nor would I, 6572, 6587
And by the way Im leading in Ohio by three points." , 6587, 6598
  ", 6598, 6599
It probably has, 6599, 6602
It probably has, 6602, 6605
Our government is so weak on this stuff, 6605, 6613
It probably has, 6613, 6616
Possible, 6616, 6617
I mean I have a lot of checks and balance, 6617, 6627
I have a good system I guess, 6627, 6634
Im not an e- mail person myself, 6634, 6641
I dont believe in it because I think it can be hacked for one thing, 6641, 6656
But when I send an e-mail I mean if I send one I send one almost never, 6656, 6673
Im just not a believer in e-mail, 6673, 6680
A lot of people have taught me that including Hillary, 6680, 6690
But honestly it could be maybe its hacked, 6690, 6698
Who knows?" , 6698, 6700
  broken the rules in traditional American politics many times, 6700, 6709
  while the other person.., 6709, 6713
", 6713, 6714
Yes but my message wasnt dark, 6714, 6720
My message was optimistic because were going to fix the problems, 6720, 6731
Go ahead." , 6731, 6733
  , 6733, 6733
OK, 6733, 6734
", 6734, 6735
Youve broken that tradition youve run a very aggressive campaign this week, 6735, 6747
What was the basis for wanting to do it this way as opposed to staying quiet..." , 6747, 6763
No basis, 6763, 6765
No basis, 6765, 6767
"Look John I didnt have to do this, 6767, 6775
When I did this believe me—you see this incredible resort, 6775, 6785
Its one of the great in the world, 6785, 6793
When I did this I could be here enjoying myself, 6793, 6803
I dont have to be with you guys, 6803, 6811
I didnt need this, 6811, 6815
I have places that are the best in the world OK, 6815, 6826
I could be doing other things, 6826, 6832
Im doing this because were going to make America great again, 6832, 6843
Im doing this because when I looked at the Iran deal which was incompetent—when I looked at whats going on with jobs being torn out of our country and going to Mexico and China whats happening with China, 6843, 6881
And with all of this with ISIS with our military being so badly depleted where we have old fighter jets, 6881, 6901
We have to take parts from museums and from graveyards." "When I look at all this I say I sort of have to do it, 6901, 6926
You know this countrys been great to me, 6926, 6934
Im giving back, 6934, 6937
Thats all." "Now as far as running a campaign I guess its probably not typical, 6937, 6952
But they said that against you know when I ran there was 17 people a total of 17, 6952, 6970
Governors Senators Ben Carson whos a fantastic guy capable people, 6970, 6980
Wait a minute, 6980, 6983
Everybody said oh he can never win because look what hes doing, 6983, 6995
Hes giving a talk to 5000 people in New Hampshire instead of going to everybodys house and having dinner." And then I won New Hampshire, 6995, 7020
And then I won you know 38 or 39 states, 7020, 7030
And won by the way not by a little bit, 7030, 7040
Won with the highest vote in the history of the Republican Party, 7040, 7052
So just.., 7052, 7054
  ", 7054, 7055
OK but John but the point is this so its a different kind of a campaign, 7055, 7071
But its what I think is good, 7071, 7078
I think its good, 7078, 7082
I think its working here too." ", 7082, 7089
But this aggressive counterprogramming the Democratic Convention is different than what weve seen in previous campaigns, 7089, 7105
And Im wondering why you felt the need to make sure that everything that was said was responded to immediately with personal appearances with campaign appearances while they were " .., 7105, 7136
", 7136, 7137
Well when Joe Biden says that I want to firebomb the enemy which was on television this morning or carpet bomb, 7137, 7158
He used the term carpet bomb, 7158, 7164
When he makes the statement that Donald Trump wants to carpet bomb I never said that, 7164, 7180
That was Ted Cruz that said that OK? That was Ted Cruz wasnt me." "When Sanders and I think a lot of his people are going to come to me because of trade, 7180, 7213
But when Bernie Sanders makes a statement that I wanted to go lower than the minimum wage lower its a lie, 7213, 7234
So I have a choice, 7234, 7239
All my people say dont respond to it it doesnt matter, 7239, 7250
I say to me it does matter, 7250, 7257
It matters." "When people tell lies politicians who tell lies very well thats what they do thats why theyre politicians, 7257, 7277
But when politicians tell lies and Im lucky in a sense because I have a big microphone, 7277, 7294
In other words I can say that Biden lied when he said that, 7294, 7307
Or I can say that I didnt say that Bernie Sanders, 7307, 7318
And you guys know that I didnt, 7318, 7325
In fact he was criticized by people that fact check for saying it because I never said it." So its nice to be able to President Obama said a year-and-a- half ago Donald Trump will never be president, 7325, 7363
Today on "The Today Show" he said this is democracy, 7363, 7373
A little bit different, 7373, 7377
Little bit different, 7377, 7380
  David go ahead Dave, 7380, 7384
Last night at the Democratic Convention   women and gay advocates made strong cases that you and the Republican Party are kind of on the wrong side of history regarding abortion rights and gay marriage, 7384, 7418
Can you clarify your position on those? ", 7418, 7426
Youll have to see it in the polls David, 7426, 7435
You know what my positions are, 7435, 7441
Youll have to see it at the polls." ", 7441, 7450
I dont know what..."   , 7450, 7454
Yeah go ahead, 7454, 7457
  , 7457, 7457
David my positions are down, 7457, 7462
You ask the question every single time, 7462, 7469
I give you an answer, 7469, 7474
My positions are down, 7474, 7478
Take a look, 7478, 7481
Go ahead, 7481, 7483
", 7483, 7484
Didnt you hold a Miss Universe Pageant—?" , 7484, 7491
Yes I did, 7491, 7494
Did Don Jr, 7494, 7497
say back in 2008 that there was Russian money pouring into the top organizations.., 7497, 7511
", 7511, 7512
We wanted to yeah I dont know what he said, 7512, 7522
But we wanted..."   , 7522, 7525
Excuse me listen, 7525, 7528
We wanted to; we were doing Miss Universe 4 or 5 years ago in Russia, 7528, 7543
It was a tremendous success, 7543, 7548
Very very successful, 7548, 7551
And there were developers in Russia that wanted to put a lot of money into developments in Russia, 7551, 7569
And they wanted us to do it, 7569, 7576
But it never worked out, 7576, 7581
"Frankly I didnt want to do it for a couple of different reasons, 7581, 7594
But we had a major developer particular but numerous developers that wanted to develop property in Moscow and other places, 7594, 7614
But we decided not to do it."   ", 7614, 7622
Yes maam go ahead." , 7622, 7626
  President Obama has said that you would never win the presidency, 7626, 7637
Last night he said that anything is possible, 7637, 7645
He did say that, 7645, 7649
What is your reaction to that? ", 7649, 7656
Well I just said sort of said that, 7656, 7664
He just said that, 7664, 7668
He said it this morning anythings possible, 7668, 7675
I think Im going to win, 7675, 7681
I think people are sick and tired of incompetence, 7681, 7690
Theyre sick and tired of having politicians leading them down the tubes, 7690, 7702
Whether its taxes whether its debt whether its any one of 15 different things, 7702, 7716
And thats why, 7716, 7719
I mean I think Ill win the election, 7719, 7727
I think youll see that in the polls." All right a few more questions, 7727, 7741
Go ahead John, 7741, 7744
Back in December.., 7744, 7747
", 7747, 7748
I hope your arms OK." ", 7748, 7754
Its all right, 7754, 7757
Back in December sir you had said that you were probably going to be going to Israel to go and meet the leadership, 7757, 7780
Now that you are the Republican nominee it is a tradition once you secure the Partys nomination to do a trip..." ", 7780, 7802
Well its a tradition but I dont do things that are traditional, 7802, 7814
But I have great support from Israel, 7814, 7821
I will back Israel 100 percent, 7821, 7827
I would like to go there, 7827, 7833
But I have great relationships as you know to the people in Israel." "And by the way Obama in my opinion is the single worst thing politically speaking thats ever happened to Israel, 7833, 7866
He has been a disaster for Israel."   ", 7866, 7874
I dont know, 7874, 7877
I dont know, 7877, 7880
I havent set my schedule yet, 7880, 7886
It could happen." , 7886, 7889
 " you are the nominee, 7889, 7894
Has you or your campaign had any conversations with foreign leaders trying to build up a relationship should you win in November that you dont have to hit the ground running " ? ", 7894, 7928
No I think we—its possible we have, 7928, 7935
But Im not—Im only interested in winning, 7935, 7942
Once I win Ill get along great with foreign leaders but they wont be taking advantage, 7942, 7958
I mean the problem we have with foreign leaders whether its China Russia or anybody they dont respect our leadership, 7958, 7978
And certainly in the case of China they take tremendous economic advantage of us—tremendous to a point that is hard to believe." "Ill get along great with the leadership, 7978, 8007
And well do well." "Yes maam in the back?" , 8007, 8016
Mr, 8016, 8017
Trump     , 8017, 8018
No no, 8018, 8020
Excuse me, 8020, 8022
In the back? , 8022, 8025
I would like to know if you became president would you recognize   Crimea as Russian territory? And also if the U.S, 8025, 8046
would lift sanctions that are  ? ", 8046, 8053
Well be looking at that, 8053, 8058
Yeah well be looking." Go ahead, 8058, 8064
Mr, 8064, 8065
Trump   questions, 8065, 8067
First a quick one on the minimum wage, 8067, 8075
You said we need to raise it to $10, 8075, 8084
  be clear here, 8084, 8087
Are you talking about the federal minimum wage? , 8087, 8095
Federal, 8095, 8096
OK, 8096, 8097
Second question about  , 8097, 8100
Right, 8100, 8101
You said  , 8101, 8103
Would religion be a part of the  ? ", 8103, 8112
Im not making it a part, 8112, 8118
But at some point maybe people will change their minds but as of right now Im not making it a part." OK, 8118, 8140
  ", 8140, 8141
Yes maam? Go ahead." , 8141, 8145
  , 8145, 8145
Who said that? , 8145, 8148
  , 8148, 8148
Who? , 8148, 8149
  ", 8149, 8150
I think President Obama has been the most ignorant president in our history, 8150, 8163
His views of the world as he says dont jive, 8163, 8173
And the world is a mess, 8173, 8179
You look at whats happening with the migration with Syria with Libya with Iraq with everything hes touched, 8179, 8197
He has been a disaster as a president, 8197, 8205
He will go down as one of the worst presidents in the history of our country, 8205, 8221
It is a mess." And I believe that Hillary Clinton will be even worse, 8221, 8235
Go ahead, 8235, 8237
  polls you  , 8237, 8239
You just said  , 8239, 8242
Oh  " just said that? Many polls show that you are winning? I cant believe it, 8242, 8258
Are you Katy Turek of NBC? Its a disguise." Go ahead, 8258, 8269
  , 8269, 8269
Many polls show you  , 8269, 8273
