Today Donald J, 0, 3
Trump announced the expansion of his campaign team making several appointments as he continues to build his operations in advance of the general elections, 3, 27
Jason Miller will serve as Senior Communications Advisor where he will work with the existing team to build out a full Communications Department to deliver victory this November, 27, 55
Mr, 55, 56
Miller will work with several areas of the campaign to ensure messaging coordination and implementation, 56, 71
Mr, 71, 72
Miller has managed campaigns and shaped messages for successful House Senate and gubernatorial races in addition to serving on the senior staffs of two presidential campaigns, 72, 98
"Michael Abboud is joining the Trump Campaign as a Communications Coordinator, 98, 109
Formerly with the RNC Communications Department Mr, 109, 116
Abboud will work to execute the campaigns rapid response and daily messaging as well as providing candidate briefings on daily news and breaking stories." Alan Cobb will serve as the Director of Coalitions for the campaign organizing and managing the numerous coalition groups that currently support and will support Mr, 116, 166
Trump for president, 166, 169
Previously Mr, 169, 171
Cobb served in several roles for the Trump Campaign including as a Senior Advisor, 171, 185
Mr, 185, 186
Cobb managed statewide political and issue campaigns served as the Deputy State Director for U.S, 186, 201
Senators Bob Dole and U.S, 201, 206
Senator Sheila Frahm and served as a Campaign Advisor to the 2014 campaigns of Congressman Mike Pompeo and Senator Pat Roberts, 206, 227
On the appointments Mr, 227, 231
Trump stated "As we continue to work to defeat Hillary Clinton this November I am constantly building a superior political team, 231, 252
After winning the most votes in the history of a Republican primary contest we are taking our messages to the people so that we can Make American Great Again." , 252, 281


