I am shocked by the heinous murder of 13-year-old Hallel Yaffa Ariel who was attacked by a Palestinian terrorist while she was sleeping in her bedroom, 0, 26
I extend my deepest condolences to the Ariel family, 26, 35
The continuing incitement and preaching of hate by the Palestinian leadership and the glorification of terror must end immediately, 35, 54
I call upon the leadership of the Palestinian Authority to condemn this murder and to take concrete steps to end this barbaric behavior, 54, 77
Donald J, 77, 79
Trump , 79, 80


