Hillary Clinton explains why there is no more important issue than defending reproductive rights, 0, 14
"At an event with NARAL Pro-Choice America and NARAL New Hampshire Hillary Clinton reminded the crowd that abortion rights arent only a health issue—theyre also an economic issue, 14, 42
" "All women deserve to have access to the health services and choices they are entitled to" Hillary said, 42, 61
   "Yes we want to get the economy working for everybody not just those at the top, 61, 77
We want to get incomes rising, 77, 83
But those of us in this room also know .., 83, 93
"  "Women cannot succeed if they cant make the most fundamental decisions about their lives families and futures." "Thats why Hillary has been fighting for reproductive rights for decades, 93, 122
She understands that gender inequality has to be addressed in order to take on economic inequality." All of the Republican presidential candidates would defund Planned Parenthood and many have said they will work to overturn  , 122, 157
With so much at stake women need a proven fighter in the White House, 157, 171


