Well Ill tell you what Im ready to grab that baton, 4396, 4407
Hes going to have to bend down for me to be able to reach it because you know hes a tall man, 4407, 4429
But Ive been practicing, 4429, 4433
I spent four years working with him, 4433, 4440
I call him my partner and my friend and I am ready to defend and build on his progress coming out of his eight years of the presidency.n" "So lets get out and vote and lets vote for the kind of future that we want the kind of country that we want, 4440, 4492
Find your early voting location for the next three days please go take people there, 4492, 4507
We will show once and for all love trumps hate thank you all." , 4507, 4520


