The children who are still here have been especially patient and I dont want to keep you any longer." I just want to say a few closing comments and then for those of you who want to stay I will shake your hands and take pictures and you can ask me questions, 4465, 4517
But everybody else can go home and not feel bad about it because I need you to get up tomorrow and help work to get more people to go to the caucus next Monday, 4517, 4551
  "And you know I am all about—I am all about making progress against the odds, 4551, 4566
I am all about working with people, 4566, 4573
I worked with Republicans as first lady as senator as secretary of State, 4573, 4586
I worked to get results for the people I represented in the Senate as well as our country, 4586, 4604
I worked when I was secretary of State to make our country safe and to have our values and interests promoted, 4604, 4625
And I know how to find common ground because Ive done it." "I dont think that—I think I—I do believe that probably every Republican I served with at one time or another sponsored a piece of my legislation, 4625, 4663
Actually when Im not running for something they say nice things about me, 4663, 4676
"  "Even in the case of Mr, 4676, 4683
Trump they give me money because they think Im so good as a candidate and a senator, 4683, 4700
So you know this is politics, 4700, 4706
This is all that that goes on." "But once the election is over I will work as hard as I can to find that common ground to get good things to happen for you for your families for your country and make it possible for young people to feel like I felt that you know really the American Dream was available, 4706, 4767
You had to work for it but if you did you could get ahead and stay ahead, 4767, 4784
Thats what I think about when it comes to my granddaughter, 4784, 4795
You know I am the granddaughter of a factory worker she is the granddaughter of a former president, 4795, 4813
I think it shouldnt matter, 4813, 4818
The grandchildren of everybody should have the same opportunities in our country, 4818, 4830
"  "And thats what I am going to stand up for and fight for, 4830, 4844
And with your help starting at the caucus next Monday night thats what we will do together, 4844, 4861
Thank you all so much, 4861, 4866
"  , 4866, 4867


