"Last night I was grossly generalistic and thats never a good idea, 0, 12
I regret saying half – that was wrong, 12, 20
But lets be clear whats really deplorable is that Donald Trump hired a major advocate for the so-called alt-right movement to run his campaign and that David Duke and other white supremacists see him as a champion of their values, 20, 60
Its deplorable that Trump has built his campaign largely on prejudice and paranoia and given a national platform to hateful views and voices including by retweeting fringe bigots with a few dozen followers and spreading their message to 11 million people, 60, 101
Its deplorable that hes attacked a federal judge for his Mexican heritage bullied a Gold Star family because of their Muslim faith and promoted the lie that our first blackxa0president is not a truexa0American, 101, 135
So I wont stop calling out bigotry and racist rhetoric in this campaign, 135, 148
I also meant what I said last night about empathy and the very real challenges we face as a country where so many people have been left out and left behind, 148, 179
As I said many of Trumps supporters are hard-working Americans who just dont feel like the economy or our political system are working for them, 179, 204
Im determined to bring our country together and make our economy work for everyone not just those at the top, 204, 224
Because we really are stronger together." , 224, 230


