"I am honored to have earned the endorsement of the Congressional Progressive Caucus Progressive Action PAC, 0, 16
"For 25 years the CPC has been a champion for working people and on behalf of Americans who have been left out and left behind, 16, 41
And CPC members know as I do that we are stronger together, 41, 53
"We are stronger when we have each others backs, 53, 62
Thats why we will fight to secure universal health care raise the minimum wage and protect Americans fundamental right to vote–not corporations right to buy elections, 62, 88
Its why we will face up to the reality of systemic racism and fix it together, 88, 104
And its why we will say no to trade agreements like the Trans-Pacific Partnership that would hurt American workers and fully enforce our trade laws to protect American jobs, 104, 133
"We are stronger when all our people can retire with dignity and security after years of hard work, 133, 151
That is why we will stand up to Republican efforts to undermine or privatize the bedrock promise of Social Security—and well fight to expand it, 151, 176
"And we are stronger when we make our economy work for everyone—not just those at the top, 176, 193
Thats why we will fight to make college debt-free and make the kinds of investments that will create good-paying jobs with a bold plan to build 21st century infrastructure revitalize American manufacturing and combat climate change and make America a clean energy superpower, 193, 236
"Progressives know that in America we dont tear each other down–we lift each other up, 236, 251
We believe in building bridges not walls, 251, 258
And we know that America is already great—because for 240 years ours has been the story of hard-fought hard-won progress." , 258, 278


