"The Great Lakes are national treasures–powering regional economies providing drinking water to tens of millions of Americans and providing unparalleled outdoor recreation, 0, 22
But the Great Lakes are facing serious stresses from pollution to toxic algal blooms to the spread of invasive species, 22, 42
"Clean water is not a luxury–its a basic right of all Americans, 42, 54
As President I will fight to protect drinking water including by investing in modernizing our outdated drinking and wastewater infrastructure and supporting the Great Lakes Restoration Initiative, 54, 81
"And I will promote conservation and collaborative stewardship of our natural resources including the Great Lakes, 81, 97
I will set a goal of doubling the size of the outdoor economy within a decade–which will benefit communities all around the Great Lakes, 97, 121
And I will support collaborative approaches to protect our environment like the agreement between Ohio Michigan and Ontario to reduce nutrient pollution that contributes to harmful algal blooms, 121, 149
"Together we can protect the Great Lakes and Americas public lands and waters for future generations." , 149, 165


