"The world now knows beyond the shadow of any doubt that the hack of the Democratic National Committee was carried out by the Russian government in a clear attempt to interfere with the integrity of our elections, 0, 37
The only remaining question is why Donald Trump continues to make apologies for the Russians, 37, 52
Trumps initial reaction to the hack in July was to invite further intrusions by the Russians, 52, 68
Even after he was reportedly briefed on the very findings that were just announced publicly by U.S, 68, 85
government officials he stood on a debate stage one week ago and played dumb about Russias role in this hack, 85, 105
He has repeatedly praised Vladimir Putin outlined a list of pro-Putin policies and has done hundreds of millions of dollars of business with Russian interests, 105, 130
Even his own running mate has criticized Putin yet Trump continues to refuse, 130, 143
It should concern every American that Russia is willing to engage in such hostile acts in order to help Donald Trump become President of the United States, 143, 170
But even worse Trumps own actions suggests he welcomes the help, 170, 181
If he wants to reassure American voters he must not only acknowledge and condemn Russias role in this outrageous intrusion against U.S, 181, 203
interests but he must finally disclose the full extent of his ties to Russia and divest any Russian-linked assets." , 203, 222


