"I am honored to have earned the endorsement of the Transport Workers Union, 0, 13
"Every day members of the TWU keep America on the move—driving our buses and trains flying our planes and keeping our communities safe and healthy, 13, 38
For decades transport workers have helped power our economy and keep families connected, 38, 51
And along the way theyve helped build the American middle class standing up for workers rights and fighting for the respect they deserve, 51, 74
"As President I will always stand with the TWU in the fight to protect workers fundamental rights to organize bargain collectively be safe on the job and retire with dignity and security after years of hard work, 74, 111
We will make the kinds of investments that grow the economy for everyone including building 21st century roads transit systems and airports, 111, 133
In my first 100 days in office I will put forward a plan to make the most ambitious investments in our infrastructure since the Interstate Highway System, 133, 160
And I will make sure workers always have a seat at the table and a champion in the White House." , 160, 180


