"This year the Orlando community suffered from the worst mass shooting in U.S, 0, 13
history, 13, 14
This was an act of hate, 14, 20
The gunman attacked an LGBT nightclub during Pride Month and devastated Orlandos Puerto Rican community, 20, 35
Our country mourns for the 49 victims lost that night and we mourn for the 33000 Americans killed by guns each year, 35, 57
"Its time for action, 57, 61
Thats whyxa0Hillary Clinton is honored to receive the endorsement of the Pride Fund - and looks forward to working with them to fight for common sense gun laws and to secure equality for LGBT Americans." , 61, 96


