"One year ago today we celebrated a watershed moment for equality in America, 0, 13
Thanks to the bravery of LGBT Americans like Jim Obergefell and Edie Windsor and the determination and tireless organizing of the LGBT community and their allies marriage equality became the law of the land in all 50 states, 13, 51
"Over the last year more barriers to equality have fallen – including finally the last state law banning same-sex couples from adopting, 51, 73
Just this month President Obama designated Stonewall as the first national monument commemorating LGBT history in America, 73, 90
"Weve also seen how much work is still unfinished, 90, 99
The attack in Orlando broke our hearts and reminded us that LGBT people – particularly people of color – are still targets for harassment and violence, 99, 125
Discriminatory laws in states like North Carolina highlight the need for full federal equality under the law for LGBT Americans, 125, 145
And Donald Trumps pledge to consider appointing Supreme Court justices who would overturn marriage equality underscores the fact that so much of the progress weve made is at stake in November, 145, 176
"But even when the road ahead seems daunting never forget: on this day in history love triumphed in the highest court in the land, 176, 200
Today our march toward a more perfect union continues—toward equality dignity and justice for all." , 200, 215


