"North Koreas decision to conduct another nuclear test is outrageous and unacceptable, 0, 12
I strongly condemn this reckless action which – coupled with its recent series of missile launches – makes clear Pyongyangs determination to develop a deliverable nuclear weapon, 12, 39
This constitutes a direct threat to the United States and we cannot and will never accept this, 39, 56
"I support President Obamas call to both strengthen the sanctions passed earlier this year with the United Nations and to impose additional sanctions, 56, 79
At the same time we must strengthen defense cooperation with our allies in the region; South Korea and Japan are critical to our missile defense system which will protect us against a North Korean missile, 79, 114
China plays a critical role too and must meaningfully increase pressure on North Korea – and we must make sure they do." This is another reminder that America must elect a President who can confront the threats we face with steadiness and strength, 114, 157
We need a Commander-in-Chief committed to a bipartisan foreign policy who can bring together top experts with deep experience to solve the toughest challenges, 157, 181
And we need a President committed to reducing – not increasing – the number of nuclear weapons and nuclear states in the world, 181, 204
More countries with nuclear weapons in Northeast Asia would increase the chances of the unthinkable happening, 204, 220
We cannot take that risk." , 220, 225


