"Tomorrow we mark the date on which hundreds of thousands of Americans marched on Washington on behalf of human rights, 0, 20
Standing in front of the Lincoln Memorial Dr, 20, 28
Martin Luther King Jr, 28, 32
uttered words now etched forever in our nations history: "His call to action sparked the momentum needed to pass the Voting Rights Act – xa0knocking down legal barriers that had stood for generations and ensuring every American could exercise their constitutional right to vote, 32, 76
"In 2016 weve come a long way since the days of Jim Crow, 76, 89
Yet too many Americans still face systemic racism and constant assaults on their franchise, 89, 103
Something is profoundly wrong when decades after Dr, 103, 111
King addressed the nation so many Americans still feel that their country values them less simply because of the color of their skin, 111, 134
"Thats just one reason why the stakes in this election are unlike any we have faced before, 134, 151
Those brave men and women who marched and sat and bled for civil rights in America must not have done so in vain, 151, 174
"As President Ill stand up to bluster and bigotry and fight back against efforts to restrict access to the ballot, 174, 194
Lets make it easier for people to vote not harder, 194, 204
Lets make sure every state has at least 20 days of in-person voting and no one ever has to wait more than 30 minutes to cast their ballot, 204, 232
And lets automatically register every American to vote on their 18th birthday, 232, 244
"The power of American democracy comes from the fact that no one is left behind – no matter where they come from what they look like or who they love, 244, 274
Thats what I mean when I say that were stronger together, 274, 285
"So today lets continue to be inspired by the self-evident truths that first united our nation and live up to what a young minister dreamed and declared fifty-three years ago." , 285, 315


