,sentence,start,end
208,My opponent on the other hand wants to put the great miners and steel workers of our country out of work and out of business – that will never happen with Donald Trump as President,87917,88097
209,Our steelworkers and our miners are going back to work again,88384,88444
210,With these new economic policies trillions of dollars will start flowing into our country,88789,88878
211,This new wealth will improve the quality of life for all Americans – We will build the roads highways bridges tunnels airports and the railways of tomorrow,89195,89350
212,This in turn will create millions more jobs,89673,89716
213,We will rescue kids from failing schools by helping their parents send them to a safe school of their choice,90072,90180
214,"""My opponent would rather protect bureaucrats than serve American children",90533,90607
215,And thats what shes doing and thats what shes done,90970,91020
216,We will repeal and replace disastrous Obamacare,91394,91441
217,You will be able to choose your own doctor again,91807,91855
218,"And we will fix TSA at the airports which is a total disaster!"" Thank you",92183,92256
219,Thank you,92604,92613
220,We are going to work with all of our students who are drowning in debt to take the pressure off these young people just starting out their adult lives,92930,93080
221,We will completely rebuild our depleted military and the countries that we protect at a massive loss will be asked to pay their fair share,93344,93482
222,We will take care of our great veterans like they have never been taken care of before,93787,93873
223,My just-released Ten Point Plan has received tremendous veteran support,94206,94277
224,We will guarantee those who serve this country will be able to visit the doctor or hospital of their choice without waiting five days in line and dying,94598,94749
225,"""My opponent dismissed the VA scandal as being not widespread – one more sign of how out of touch she really is",95009,95120
226,We are going to ask every Department Head in government to provide a list of wasteful spending projects that we can eliminate in my first 100 days,95385,95531
227,"The politicians have talked about it Im going to do it."" We are also going to appoint justices to the United States Supreme Court who will uphold our laws and our Constitution",95783,95958
228,The replacement for our beloved Justice Scalia will be a person of similar views and judicial philosophies,96246,96352
229,Very important,96737,96751
230,This will be one of the most important issues decided by this election,97156,97226
231,My opponent wants to essentially abolish the 2nd amendment,97618,97676
232,I on the other hand received the early and strong endorsement of the National Rifle Association and will protect the right of all Americans to keep their families safe,98003,98170
233,"""At this moment I would like to thank the evangelical and religious community because Ill tell you what the support they have given me and Im not sure I totally deserve it has been so amazing and has had such a big reason for me being here tonight",98375,98622
234,So true,98867,98874
235,They have so much to contribute to our politics yet our laws prevent you from speaking your minds from your own pulpits,99209,99328
236,An amendment pushed by Lyndon Johnson many years ago threatens religious institutions with a loss of their tax-exempt status if they openly advocate their political views,99628,99798
237,"Their voice has been taken away."" I am going to work very hard to repeal that language and protect free speech for all Americans",100096,100224
238,We can accomplish these great things and so much else – all we need to do is start believing in ourselves and in our country again,100479,100609
239,Start believing,100930,100945
240,It is time to show the whole world that America Is Back – bigger and better and stronger than ever before,101264,101369
241,"""In this journey Im so lucky to have at my side my wife Melania and my wonderful children Don Ivanka Eric Tiffany and Barron: you will always be my greatest source of pride and joy",101615,101795
242,And by the way Melania and Ivanka -- did they do a job? My Dad Fred Trump was the smartest and hardest working man I ever knew,102020,102146
243,"I wonder sometimes what hed say if he were here to see this and to see me tonight."" ""Its because of him that I learned from my youngest age to respect the dignity of work and the dignity of working people",102339,102543
244,He was a guy most comfortable in the company of bricklayers carpenters and electricians and I have a lot of that in me also,102777,102900
245,"I love those people."" ""Then theres my mother Mary",103207,103256
246,She was strong but also warm and fair-minded,103599,103643
247,She was a truly great mother,103993,104021
248,She was also one of the most honest and charitable people I have ever known and a great judge of character,104335,104441
249,"She could pick em out from anywhere."" To my sisters Mary Anne and Elizabeth my brother Robert and my late brother Fred I will always give you my love you are most special to me",104687,104863
250,I have loved my life in business,105130,105162
251,"""But now my sole and exclusive mission is to go to work for our country – to go to work for all of you",105436,105538
252,Its time to deliver a victory for the American people,105802,105855
253,We dont win anymore but we are going to start winning again,106156,106215
254,"But to do that we must break free from the petty politics of the past."" America is a nation of believers dreamers and strivers that is being led by a group of censors critics and cynics",106474,106659
255,"""Remember: All of the people telling you that you cant have the country you want are the same people that wouldnt stand -- I mean they said Trump doesnt have a chance of being here tonight",106864,107052
256,Not a chance! The same people,107321,107350
257,Oh we love defeating those people dont we? Love it love it love it,107670,107736
258,No longer can we rely on those same people in politics and in the media who will say anything to keep a rigged system in place,108006,108132
259,"Instead we must choose to Believe In America."" History is watching us now",108405,108478
260,"""Its waiting to see if we will rise to the occasion and if we will show the whole world that America is still free and independent and strong",108760,108901
261,"Im asking for your support tonight so that I can be your champion in the White House."" My opponent asks her supporters to recite a three-word loyalty pledge",109143,109299
262,"It reads: ""Im With Her""",109616,109639
263,I choose to recite a different pledge,110010,110047
264,"My pledge reads: ""IM WITH YOU – THE AMERICAN PEOPLE."" I am your voice",110391,110460
265,"""So to every parent who dreams for their child and every child who dreams for their future I say these words to you tonight: Im With You and I will fight for you and I will win for you."" To all Americans tonight in all our cities and towns I make this promise: We Will Make America Strong Again",110649,110943
266,We Will Make America Proud Again,111217,111249
267,We Will Make America Safe Again,111626,111657
268,And We Will Make America Great Again,112034,112070
269,God bless you and good night! I love you! ,112447,112488
