,sentence,start,end
0,"""The month of June represents the first full month of fundraising activity for the campaign and this will be reflected in the June FEC report",0,141
1,The campaign held its first campaign fundraising event on May 25th 2016,576,647
2,To date the campaigns fundraising has been incredible and we continue to see a tremendous outpouring of support for Mr,1028,1146
3,Trump and money to the Republican Party,1504,1543
4,"The positive response to our fundraising efforts so far is a further indication that the country does not want yet another corrupt politician like Crooked Hillary."" Mr",1895,2062
5,"Trump added ""If need be there could be unlimited ""cash on hand"" as I would put up my own money as I have already done through the primaries spending over $50 million dollars",2365,2538
6,"Our campaign is leaner and more efficient like our government should be."" ",2976,3049
