,sentence,start,end
0,"""The Republican primary season comes to an end today",0,52
1,With each contest that has passed Donald Trump has energized Republican voters like never before,505,601
2,After eight years of a lagging economy failing foreign policy and broken healthcare system the American people are making clear that they want a new type of leader in the White House,1030,1212
3,While Hillary Clinton offers the same failed policies of Barack Obama Trump represents a movement away from the status quo in Washington,1491,1627
4,He is a successful businessman with the executive experience and courage we desperately need to bring back our jobs grow our economy strengthen our military and secure our borders,1932,2111
5,"I look forward to continuing to work hard to make sure that Trump becomes the next president of the United States."" View more at the link here:  ",2533,2676
