,sentence,start,end
0,"""Due to the horrific tragedy that has just taken place in Orlando Florida Mr",0,76
1,Trump is postponing the rally scheduled to take place tomorrow in Portsmouth New Hampshire,519,609
2,We will make it up in the near future,1052,1089
3,Mr,1532,1534
4,Trump will however deliver a major speech at St,1972,2019
5,Anselms College tomorrow afternoon,2465,2499
6,"He looks forward to returning to New Hampshire and discussing the serious threats facing all Americans and his solutions for making this country safe again."" ",2945,3102
