,sentence,start,end
0,"""As is standard practice for all major businesses organizations and other entities dealing with proprietary information Mr",0,122
1,Trump requires employees to sign and adhere to strict confidentiality agreements,599,679
2,When the agreements are not adhered to he will enforce them to the full extent of the law and Mr,1152,1248
3,Trumps litigation track record on such matters is outstanding,1651,1712
4,With regard to Mr,2193,2210
5,Nunberg this agreement specifically calls for arbitration and Mr,2691,2755
6,"Nunberg is simply looking for free publicity using categorically false claims."" - Alan Garten Trump Counsel ",3236,3343
