,sentence,start,end
229,The perpetrators were illegal immigrants with criminal records a mile long but who did not meet the Obama administrations priorities for removal,91044,91188
230,"People begged that they be incarcerated or be moved out of the country but our geniuses wouldnt listen.n"" ""In California a 64-year-old Air Force veteran Marilyn Pharis was sexually assaulted and beaten to death with a hammer",91473,91697
231,Her killer had been arrested on multiple occasions but was never deported,92000,92073
232,People asked please please deport him,92461,92498
233,This is what happened,92880,92901
234,This is a crime wave that never ends,93264,93300
235,"I can tell you its thousands of cases like this.n"" ""When Im president believe me it will end",93628,93720
236,""" n Not only will a wall keep out the dangerous cartels and criminals but will also keep out the drugs remember New Hampshire and the heroin poisoning our youth",93986,94146
237,"Our youth is being poisoned before they get a chance  n ""And by the way Ive met plenty of people in New Hampshire that are not our youth that have a tremendous problem and I want to tell you were going to work with people were going to set up programs were going to try everything we can to get them unaddicted unaddicted",94285,94605
238,""" n So as I said when I won the New Hampshire primary I promised the people of New Hampshire that we would stop drugs from pouring into your community and I guarantee you we will",94730,94908
239,You will be so proud of your president you will be so proud of your community,95155,95232
240," n You will be so proud.n ""I just want to say in closing I just want to say in closing that we have an amazing movement going on",95479,95606
241,A movement like theyve never seen before a movement that hopefully wont be stopped,95879,95961
242,We have a movement that the biggest people in the world of the media the biggest have said theyve never seen anything like it before,96273,96405
243,"Every every crowd every auditorium.n"" ""The other night we had a situation",96717,96790
244,We had thousands and thousands of people and I said to the fire marshal isnt it possible to let more in? We had thousands of people in this massive field and we had many thousands outside of the gates they wouldnt let in and I said couldnt we let them in? And they said we cant,97005,97282
245,I said but theres no fire were outside,97491,97529
246,He said its stampede Mr,97864,97887
247,"Trump were worried about a stampede.n"" ""And its a stampede of love",98208,98274
248,Its true,98611,98619
249,Its not a stampede its a stampede of love,98970,99011
250,""" n ""Because there was so many people",99364,99401
251,They said we have very strong security guards but Mr,99745,99797
252,Trump theyre not nearly strong as 45000 people come charging forward,100135,100203
253,So I fully understood it,100564,100588
254,But we have something going on thats so special,100961,101008
255,Its so special,101386,101400
256,Were going to reduce your taxes were going to simplify your taxes,101770,101835
257,Were going to make your businesses welcome in our country,102189,102246
258,""" n ""Were going to reduce the taxes for middle-income people",102601,102661
259,We call them the forgotten men and women,103011,103051
260,Greatly simplify your returns,103420,103449
261,"The only company that I can think of that wont like us is H&R Block they will not like us.n"" ""Theyre not gonna like Trump too much.n"" ""But well greatly simplify your taxes",103759,103930
262,And your businesses were taking it from 35 percent which is one of the highest in the world just about the highest down to one of the lowest in the world 15 percent,104155,104319
263,""" n ""Were getting rid of a lot of the regulations that are stopping growth",104585,104659
264,Tremendous amounts of regulation are killing your small businesses and your big businesses,104993,105083
265,"So were gonna have a very tax- friendly country again and its gonna mean jobs its gonna mean expansion its gonna mean new companies growing.n"" ""We are going to create the border",105394,105571
266,We are going to stop the drugs,105869,105899
267,Were gonna have people come into our country,106254,106298
268,We want people to come into our country but they have to come in legally,106618,106690
269,They have to come in through a legal process,106990,107034
270,We want a lot of people to come in,107364,107398
271,""" n ""And theyre going to come in but theyll come in legally",107720,107779
272,And were gonna streamline the process,108098,108135
273,People are waiting on line now 10 years,108461,108500
274,Were gonna streamline because we want people to come in but we want them to come in legally,108809,108900
275,And we want merit too,109219,109240
276,We want to take wonderful great people that love our country they want to get out and they want to do a great job,109527,109640
277,We want to have them also come in based on merit,109905,109953
278,A word you dont hear anymore,110275,110303
279,A word you dont hear any more,110626,110655
280,"Its too bad.n"" ""Were also going to very importantly appoint justices to the Supreme Court "" n Who you can be proud of and who will respect the Constitution of the United States",110932,111108
281," n ""Were going to save our Second Amendment which is under unbelievable siege",111390,111466
282,""" n ""Were going to help big league on education were going to go with choice so important and were going to terminate Common Core and bring education local",111763,111918
283,""" n ""Our military is depleted",112231,112260
284,Were going to rebuild our military,112617,112651
285,We are going to lead through strength,113012,113049
286,""" n ""And hopefully were not gonna have to use our military but I will say this",113367,113445
287,Were getting rid of ISIS,113767,113791
288,Were getting rid of ISIS,114142,114166
289,""" n ISIS is we have no choice",114510,114539
290,By the way not since medieval times has anyone seen chopping off of heads drowning in steel cages burying in sand,114839,114952
291,Not since not since medieval times,115265,115299
292,"It all grew during the tenure of Obama and Hillary Clinton.n ""ISIS you know she stands up and she says what shes gonna do",115609,115730
293,Well she was there,116036,116054
294,It came out of the vacuum because we should have never gone into Iraq but once we did we should have gone out the right way not the wrong way,116330,116471
295,And the way they went out was so bad so bad including giving back Mosul which now theyre fighting to take back,116710,116820
296,And it would have been nice the element of surprise,117108,117159
297,"Do we agree? Does anybody not agree? "" n ""The element of surprise",117485,117550
298,We dont use the element of surprise,117895,117930
299,We use the element of tell them everything we can possibly tell them give them plenty of time to get ready and then attack,118227,118349
300,"And it turns out to be a lot tougher than they ever thought.n"" ""But were going to have a country that youre going to be proud of again",118590,118724
301,Were going to have a president that hopefully you will be proud of,118988,119054
302,""" n ""I will work so hard for every community",119396,119440
303,Ill be working very hard for the African-American community for the Hispanic community,119783,119869
304,Ill be working hard for every community,120228,120267
305,And were gonna have this divided nation come together,120638,120691
306,And I just want to say were gonna make America strong again were gonna make America doesnt sound nice but we have no choice wealthy again,121010,121147
307,""" n But we are going to make America great again",121436,121484
308," n ""And I want to thank everybody in New Hampshire",121831,121880
309,Get out and vote,122261,122277
310,Youre very special people,122658,122683
311,Youre very very special people,123064,123094
312,God bless you get out and vote,123475,123505
313,""" n Thank you",123886,123899
314,Thank you New Hampshire,124280,124303
315,  ,124684,124683
