,sentence,start,end
221,Once you do that they will stay out,91889,91924
222,Right now they have no consequence,92304,92338
223,"They have no consequence.n"" Also reforms on visa rules to enhance penalties for overstaying and to ensure open jobs are offered to American workers first",92686,92839
224, n 8,93207,93210
225,Restoring Community Safety Act,93629,93659
226,Reduces surging crime drugs and violence by creating a Task Force On Violent Crime and increasing funding for programs that train and assist local police who are doing such a great job believe me,93982,94177
227,We increase the resources for federal law enforcement agencies and federal prosecutors to dismantle criminal gangs and put violent offenders behind bars   or out of our country and into the country where they came from,94432,94648
228, n 9,94996,94999
229,Restoring National Security Act,95441,95472
230,"Which rebuilds our military by eliminating the defense sequester which has been very tough on military and expanding military investment.n ""Now at no time practically do we need a military like right now",95797,96000
231,We dont want to use it but it is peace through strength,96290,96345
232,We need a strong military,96709,96734
233,""" n ""Our military is so terribly depleted",97107,97148
234,It also provides Veterans with the ability to receive public VA treatment or attend the private doctor of their choice,97460,97578
235,If theyre waiting on line and I have the plan up and weve gotten as you know tremendous support from veterans from law enforcement from veterans from the military tremendous support,97866,98047
236,But if theyre waiting in line and you see it 22 suicides a day people dont even believe it but 22 suicides a day,98307,98419
237,But if theyre waiting in line 47 days 6 days 9 days they cant get to see a doctor and a simple procedure or a simple prescription can solve their problem and they become very sick and they die they die waiting in line,98601,98818
238,Were going to give them the power to go across the street to a local doctor a private doctor a public hospital or private hospital all looking to help and all looking to do business,98998,99179
239,And we will pay the bill,99464,99488
240,So much cheaper but much more importantly the veterans will finally be taken care of properly because what they are going through now is unacceptable,99807,99956
241,""" n Also we are going to protect our vital infrastructure from the new thing cyber-attack; establishes new screening procedures for immigration to ensure those who are admitted to our country support our people and our values   we want people that love our country or can love our country and people that will love our citizens",100173,100498
242," n ""We want people that can love us and there are ways through talent of determining that and other countries do but we dont",100672,100795
243,Just come on in folks,101119,101140
244,"Just come on in.n"" 10",101533,101554
245,Clean up Corruption in Washington Act,101941,101978
246,Enacts tough new ethics reforms to reduce the corrupting influence of special interests and donors on our politics.n On November 8th Americans will be voting for this 100-day plan to restore prosperity to our economy security to our communities and honesty to our government,102265,102539
247,This is my pledge to you,102850,102874
248,And if we follow these steps we will once more have a government of by and for the people,103297,103386
249, n And importantly we will Make America Great Again.n Believe me,103809,103872
