,sentence,start,end
0,"After Chinese government officialsxa0 xa0yesterday that China will continue to support overcapacity in their steel production Hillary Clinton released the following statement condemning the unfair decision as threatening to American manufacturing and jobs and pledging to take on Chinese trade abuses as President: ""Clinton has a long record of standing up to abusive Chinese trade practices",0,391
1,As Senator she fought for workers and manufacturers in New York standing up to China when they tried to put tariffs on New Yorks exports,641,777
2,In communities across the state from Buffalo to Rochester to Albany Clinton brought together workers businesses large and small and every level of government to work to invest in good-paying jobs and production in the state,1042,1265
3,"As Secretary of State she confronted Chinese leaders on a wide swath of issues from cyber attacks to human rights to climate change."" Clintonxa0 ""xa0that America spent generations working with partners to develop strong and fair rules of the road for the global economy – but those rules only work if the U.S",1436,1744
4,enforces them.xa0Tough enforcement and other smart policies to support a manufacturing renaissance are the only way we can ensure that trade helps American workers,2051,2214
5,"Thats why throughout this campaign Clinton has made clear that as President shexa0"" : ",2684,2769
