,sentence,start,end
0,Watch their conversation,0,24
1,On a cold Saturday in February Hillary Clinton set up shop on a college campus,440,518
2,She invited students to ask her anything they wanted—whether they were planning to vote for her or not,934,1036
3,   Now that also surrounds you with a certain amount of distrust from the American people,1417,1503
4,"What do you say to the people that hold this distrust and how would you gain their trust? "" Thats a very fair question."" n n n n n ""Originally"" Jack says ""I thought she was a regular politician who was going to talk about herself and defuse every question."" n n ",1772,2033
