,sentence,start,end
0,"""Hillary Clintons position on the Trans-Pacific Partnership is well-established and well-known: she opposes TPP before or after the election",0,140
1,xa0Hillary Clinton has made clear that she is not interested in tinkering around the margins with TPP and believes we need a new approach to trade that protects American jobs raises incomes for American workers and strengthens our national security,602,850
2,"""We are proud to stand with our friends in organized labor in passing a strong amendment to the Democratic Platform on all trade deals including the TPP introduced by AFSCMEs Lee Saunders which was backed full-throatedly by unions and other delegates in the room",1051,1313
3,With the amendment the platform lays out a clear high test for judging trade agreements including whether they raise wages create good-paying jobs and enhance our national security,1558,1738
4,"She believes that the TPP fails the test that is now laid out in the platform as a result of this amendment."" ",2186,2295
