,sentence,start,end
0,"""In his darkest speech yet Donald Trump doubled down on his anti-immigrant rhetoric and attempted to divide communities by pitting people against each other andxa0demonizingxa0immigrants",0,186
1,"Trump committed toxa0sending a new ""Deportation Task Force"" into American communities rescinding the Presidents executive actions to protect DREAMers and their families building a wall that he continues to claim will be paid for by Mexico and made clear that ""Operation Wetback"" was not severe enough",643,943
2,The only immigrants allowed in the future are those that pass Donald Trumps own test of desirability,1192,1292
3,"""Donald Trump once again showed us that he will continue his decades-long record of divisiveness and campaign of hate by pledging to forcibly remove every single undocumented immigrant from our country",1615,1816
4,"He showed us very clearly whats at stake in this election by painting a picture of his idea of America: one in which immigrants are not welcomed and one in which innocent families are torn apart."" ",2179,2375
