,sentence,start,end
0,"""Donald Trump likes to brag about his skills as a negotiator—but yesterday he had to be ordered by the National Labor Relations Board to stop breaking the law respect his workers fundamental rights to organize and bargain collectively and come to the table",0,256
1,Its appalling but its not surprising,649,685
2,This is a man who personally signed a contract with a union-busting firm to try to stop UNITE HERE and the Culinary Workers Union from organizing in the first place and engaged in a months-long intimidation campaign to bully his workers against voting to form a union,952,1219
3,"""I was proud to visit workers on the picket line at the Trump International Hotel in Las Vegas and even prouder when they overcame Donald Trumps intimidation campaign and were officially certified as a union earlier this year",1405,1630
4,I believe that when unions are strong families are strong—and when families are strong America is strong,1922,2026
5,"And I will always stand with workers in protecting their rights to organize bargain collectively be safe on the job and retire with dignity and if I am elected President workers will always have a seat at the table and a champion in the White House."" ",2373,2623
