,sentence,start,end
0,"""I am appalled that National Guard officials are attempting to recoup money from soldiers who accepted bonuses a decade ago – with the active encouragement of government officials and through no fault of their own – for bravely enlisting to serve our country during a time of war",0,279
1,These troops deserve our support and our deepest gratitude; they served admirably and upheld their part of the bargain,598,716
2,It is unacceptable to now subject them and their families to undue financial burdens thanks to to mismanagement from the California National Guard and rigid bureaucracy on the part of the Pentagon,1019,1215
3,"""I am calling on Congress to swiftly pass legislation to right this wrong",1532,1605
4,In the meantime we should assist these families in identifying and applying for relief as well establishing an expedited review process,2052,2187
5,"We simply cannot allow this type of mistreatment of veterans for any reason."" ",2651,2728
