,sentence,start,end
0,"""Like a schoolyard bully who cant rely on facts or issues Trump has only one way of responding to legitimate criticism of his own vulnerabilities:xa0I know you are butxa0what am I? Hillary Clintons well-founded criticisms of Trump laid out in meticulous detail become taunts and insults from Trump with no basis in reality",0,322
1,When she lays out a thoughtful speech outlining why he is unfit to be Commander in Chief he calls her unhinged,605,715
2,She gives a speech on his disturbing history of racial discrimination and ties to white supremacists and the alt-right movement he calls her a bigot,1006,1154
3,You could dismiss these actions as insecure schoolyard behavior but this man is running to be President of the United States,1496,1620
4,"As Hillary Clinton has said anyone you can bait this easily is not someone you can trust be Commander in Chief."" ",2052,2164
