,sentence,start,end
192,"Hello, Virginia! After an exciting week on the trail with @HillaryClinton, I'm so happy to be home. -TK",22672,22775
193,"Why not carrier pigeons, @realDonaldTrump? https://t.co/lNrJcakpJW",22776,22842
194,"""No one—no one—has given more for our freedom and security than our Gold Star families."" —@POTUS at @DAVHQ https://t.co/4xONzNk04z",22843,22973
195,17 Gold Star families write to Trump: “Ours is a sacrifice you will never know.” (via @votevets) https://t.co/rfpcUFLbdn,22974,23094
196,.@FLOTUS brought the house down. A Muslim family reminded us what America is about. We shattered a glass ceiling. https://t.co/J6AR3eaNU8,23095,23232
197,"Kind of assumed Trump's approach would be more RT if by land, like if by sea. https://t.co/ddEI0z9LR9",23233,23334
198,"Watch backstage as Hillary, @TimKaine, and their families listen to the benediction to close out the DNC. https://t.co/L2qe6EWCjf",23335,23464
199,Meet another Gold Star family with some personal perspective on Donald Trump: https://t.co/z2eJfg9dv0,23465,23566
200,"Your courage is inspiring, Mrs. Khan—and you’re right. https://t.co/wWrx9f65o0",23567,23645
201,"Do all the good we can, in all the ways we can, in all the places we can, for all the people we can. https://t.co/L2qe6FedaN",23646,23770
202,The @HoustonChron endorsed @MittRomney in 2012. Here's why they're endorsing Hillary in 2016: https://t.co/UtZQtQ34fi,23771,23888
203,Road trip. https://t.co/l87tQGIngk,23889,23923
204,"He’s also made clear he’s fully committed to Hillary's policy agenda, which he understands includes repeal of Hyde. https://t.co/lzHg0WpJst",23924,24063
205,"She is a Gold Star mother, she is Muslim, and she has some words for Donald Trump. https://t.co/KlbmAQ2V0w https://t.co/hs16XIUoZK",24064,24194
206,"Thank you, @JoeBiden. https://t.co/z1Jb6CrtzH",24195,24240
207,"Hillary is ""guided by the sacrifice"" of those that give their life to this country. Trump denigrates their families https://t.co/6nCEzUEtjh",24241,24380
208,"Sarah McBride, the first trans person to speak at a party convention: ""Despite our progress, so much work remains."" https://t.co/Kkt982nCSM",24381,24520
209,"Their paths may vary, but their call is the same. Meet the women of the U.S. Senate: https://t.co/tHAcE6LziY",24521,24629
210,"There's only one way to talk about Gold Star parents: with honor and respect. Capt. Khan is a hero. Together, we should pray for his family.",24630,24770
211,A night to remember. https://t.co/lJ2M2QtFJD,24771,24815
212,The American people have always made this country great. https://t.co/agqzKq3jOi,24816,24896
213,"Captain Khan and his family represent the best of America, and we salute them. https://t.co/MGeJXPF2DE",24897,24999
214,"Our Commander-in-Chief shouldn’t insult and deride our generals, retired or otherwise. That really should go without saying.",25000,25124
215,"Donald Trump says he wants to ""make America great again."" Well, he could start by actually making things in America.",25125,25241
216,"We're going to make the biggest investment in new, good-paying jobs since World War II: https://t.co/eSMDdK4HRw",25242,25353
217,“Donald Trump spoke for 75 minutes and offered zero solutions.” —Hillary on Trump’s convention speech: https://t.co/XpTG9bmbEu,25354,25480
218,“I don’t think President Obama &amp; Vice President Biden get the credit they deserve for saving the American economy.” https://t.co/O4WVMHNmOd,25481,25624
219,"Americans don’t say: “I alone can fix it.” We say: “Ok, how are we going to fix this together?”",25625,25720
220,Don’t believe anyone who says “I alone can fix it.” Those were actually Donald Trump’s words at the Republican convention in Cleveland.,25721,25856
221,We have the most productive workers in the world. We just need to give our people a chance to succeed: https://t.co/AONn3gbach,25857,25983
222,"""On Thursday, I was incredibly grateful and humbled to accept the Democratic Party’s nomination."" —Hillary",25984,26090
223,"Listen in from Johnstown, PA as Hillary and @TimKaine discuss innovation and manufacturing: https://t.co/ESV9yL7umg",26091,26206
224,Incredibly proud of Hillary and so happy to join her and Tim on the trail this week. https://t.co/u8LYZnUejj,26207,26315
225,Get live updates from Hillary and @TimKaine's bus tour → https://t.co/8kbj5eeWmS https://t.co/Y2NJ43ovA3,26316,26420
226,"Today in 1965, Pres Johnson signed Medicare &amp; Medicaid into law. We must protect &amp; strengthen these critical programs. That's why #ImWithHer",26421,26569
227,"When any barrier falls in America, it clears the way for everyone. https://t.co/nz6Y29DMwP",26570,26660
228,Watch: #KhizrKhan asks Mitch McConnell and Paul Ryan to repudiate Trump. Tune in to @TheLastWord for the interview https://t.co/rtp6TJOySL,26661,26799
229,"If you want to see the best of America, you need look no further than the example set by Army Captain Humayun Khan. https://t.co/aEhY06r7St",26800,26939
230,Hillary accepted the Democratic nomination for president on Thursday. (There were balloons.) https://t.co/yURPGlmYkR https://t.co/jbh1J7Oqwx,26940,27080
231,"Donald Trump has painted a dark, divisive picture of America. We have 102 days to stop him from becoming president. https://t.co/hp3Bb0AS5Y",27081,27220
232,Headlines for the history books. https://t.co/K7GWRf2KM4,27221,27277
233,"With the first local transmission of Zika in FL, it’s even more critical for Republicans to stop blocking action: https://t.co/KjmWMDOgDl",27278,27415
234,Big victory for democracy as the 4th Circuit just struck down a NC voter discrimination law. Let’s keep fighting to make voting easier. -H,27416,27554
235,"Capt. Khan embodied the best of our values when his actions saved his unit. Last night, his parents told his story: https://t.co/3z8Wvf8Xdg",27555,27694
236,"“Contrary to Donald Trump, I believe every time we knock down a barrier in America, it liberates everyone in America.” —Hillary",27695,27822
237,"""We've got to make this economy work for everyone, not just those at the top."" —Hillary: https://t.co/Et5D2WbDNI",27823,27935
238,"""Our Founders came together to create one nation because they knew what we know: We are stronger together."" —Hillary",27936,28052
239,"“As of tomorrow, we have 100 days to make our case to America. So what better place to kick off this campaign than where it all started?""",28053,28190
240,"""This has been such an exciting...week! We heard the man from Hope, Bill Clinton &amp; the man of hope, Barack Obama."" https://t.co/gefWILX2iW",28191,28333
241,Hillary &amp; @TimKaine take the stage in Philadelphia at their first campaign rally as the official Democratic ticket: https://t.co/aYKAX9LUgU,28334,28477
242,We share this basic belief: Do all the good you can and serve one another. That's what this election is about. https://t.co/5w70TtVfay,28478,28612
243,"""Let’s look to the future with courage and confidence. Let’s build a better tomorrow for our beloved children."" https://t.co/jcMy9VIuIJ",28613,28748
244,The next president—and her husband. https://t.co/W5A0rHs21y,28749,28808
245,"Let's go win this, together. https://t.co/vCKpROauyZ",28809,28861
246,Thank you. https://t.co/zTgGmMfHQg,28862,28896
247,"Great speech. She's tested. She's ready. She never quits. That's why Hillary should be our next @POTUS. (She'll get the Twitter handle, too)",28897,29037
248,"In America, we’re always stronger together. https://t.co/7TJgiJiqzv",29038,29105
249,"""Yes, the world is watching what we do. Yes, America's destiny is ours to choose. So let's be stronger together my fellow Americans!""",29106,29239
250,"""We lost our mother a few years ago but I miss her every day. And I still hear her voice urging me to keep working, keep fighting for right""",29240,29380
251,"""She never let me back down from any challenge...she was right. You have to stand up to bullies."" —Hillary on advice from her mom, Dorothy",29381,29519
252,"Every generation of Americans has come together to make our country freer, fairer, and stronger. None of us…can do it alone.” —Hillary",29520,29654
253,"“Enough with the bigotry and bombast. Donald Trump's not offering real change, he’s offering empty promises.” —Hillary",29655,29773
254,“Here's the sad truth: There is no other Donald Trump. This is it.” —Hillary,29774,29850
255,Let’s put ourselves in the shoes of young black &amp; Latino people who face the effects of systemic racism and feel their lives are disposable.,29851,29995
256,"""I refuse to believe we can't find common ground here. We have to heal the divides in our country.” —Hillary https://t.co/hGRbyjBeMl",29996,30128
257,We need to start listening to each other. Hearing each other. Walking in each other’s shoes.,30129,30221
258,"""I'm not here to take away your guns. I just don't want you to be shot by someone who shouldn't have a gun in the first place.” —Hillary",30222,30358
259,"""If we’re serious about keeping our country safe, we also can’t afford to have a president who’s in the pocket of the gun lobby."" —Hillary",30359,30497
260,"""A man you can bait with a tweet is not a man we can trust with nuclear weapons."" —Hillary",30498,30588
261,"""Donald Trump can't even handle the rough-and-tumble of a presidential campaign...Imagine him in the Oval Office facing a real crisis.""",30589,30724
262,"""A president should respect the men and women who risk their lives to serve our country."" —Hillary",30725,30823
263,"""Donald Trump says, and this is a quote, 'I know more about ISIS than the generals do.' No, Donald, you don't.” —Hillary",30824,30944
264,"""I'm proud that we shaped a global climate agreement. Now we have to hold every country accountable to their commitments"" —Hillary",30945,31075
265,"""Keeping our nation safe and honoring the people who do that work will be my highest priority.” —Hillary",31076,31180
266,"""Donald Trump says he wants to make America great again—well, he could start by actually making things in America again."" —Hillary",31181,31311
267,"""Please explain to me what part of America First leads him to make Trump ties in China, not Colorado. Trump suits in Mexico, not Michigan.""",31312,31451
268,"""Remember what the president said last night: Don’t boo, vote!” —Hillary: https://t.co/xahMq2KuSY",31452,31549
269,"""In Atlantic City…you will find contractors and small businesses who lost everything because Donald Trump refused to pay his bills"" —Hillary",31550,31690
270,"""If you believe that every man, woman &amp; child in America has the right to affordable health care, join us!” —Hillary https://t.co/Bk9KW26OoQ",31691,31835
271,"""If fighting for affordable child care and paid family leave is playing the woman card, then deal me in!” —Hillary https://t.co/xdbNvUvcVC",31836,31974
272,"“Way too many dreams die in the parking lots of banks. In America, if you can dream it, you should be able to do it.” —Hillary",31975,32101
273,"""Bernie Sanders and I will work together to make college tuition-free for the middle class and debt-free for all."" —Hillary",32102,32225
274,"“If you believe that your working mother, wife, sister, or daughter deserve equal pay, join us!” —Hillary",32226,32331
275,"""If you believe we should expand Social Security and protect a woman's right to make her own heath care decisions, join us!” —Hillary",32332,32465
276,"""If you believe that companies should share profits with their workers, not pad executive bonuses, join us."" —Hillary",32466,32583
277,"""Comprehensive immigration reform will grow our economy and keep families together, and it’s the right thing to do."" —Hillary",32584,32709
278,"""When we have millions of hardworking immigrants contributing to our economy, it would be self-defeating and inhumane to kick them out.""",32710,32846
279,"""I believe that climate change is real and that we can save our planet while creating millions of good-paying clean energy jobs."" —Hillary",32847,32985
280,"""It’s wrong to take tax breaks with one hand and give out pink slips with the other."" —Hillary",32986,33080
281,“We'll pass a constitutional amendment to overturn Citizens United!” —Hillary,33081,33158
282,"“With your help, I will carry all of your voices with us to the White House!” —Hillary https://t.co/g0ntLQkq6B",33159,33269
283,"""I believe that our economy isn't working the way it should because our democracy isn't working the way it should."" —Hillary",33270,33394
284,"""My primary mission as president will be to create more opportunity and more good jobs with rising wages right here in the United States.""",33395,33533
285,"“Democrats, we are the party of working people.” —Hillary",33534,33591
286,"""When any barrier falls in America, for anyone, it clears the way for everyone...when there are no ceilings, the sky’s the limit."" —Hillary",33592,33731
287,"""We’ve reached a milestone...the first time that a major party has nominated a woman for president."" —Hillary https://t.co/WizdsD8vgk",33732,33865
288,"""I will be a president for Democrats, Republicans, and Independents. For the struggling, the striving and the successful…for all Americans.""",33866,34006
289,"""It’s true: I sweat the details of policy...because it’s not just a detail if it’s your kid, if it’s your family. It’s a big deal.""",34007,34138
290,"""Simply caring is not enough. To drive real progress, you have to change both hearts and laws."" —Hillary",34139,34243
291,"""No one gets through life alone. We have to look out for each other and lift each other up."" —Hillary",34244,34345
292,"""I accept your nomination for president of the United States!” —Hillary https://t.co/3Ffpf7W4Vz",34346,34441
293,"""Through all these years of public service, the 'service' part has always come easier to me than the 'public' part."" —Hillary",34442,34567
294,"""It is with humility, determination, and boundless confidence in America’s promise that I accept your nomination for president!"" —Hillary",34568,34705
295,"""'Stronger Together’ is...not just a slogan for our campaign. It’s a guiding principle for the country we’ve always been."" —Hillary",34706,34837
296,"""None of us can raise a family, build a business, heal a community or lift a country totally alone.” —Hillary #StrongerTogether",34838,34965
297,"""Americans don’t say, 'I alone can fix it.' They say, ‘We’ll fix it together!’” —Hillary",34966,35054
298,"""Don’t believe anyone who says 'I alone can fix it.’ Yes, those were actually Donald Trump’s words in Cleveland."" —Hillary",35055,35177
299,Don’t let anyone tell you that our country is weak—we’re not. Don’t let anyone tell you we don’t have what it takes—we do.,35178,35300
300,"""We have the most dynamic and diverse people in the world. We have the most tolerant and generous young people we've ever had."" —Hillary",35301,35437
301,"""We will not ban a religion—we will work with all Americans and our allies to fight and defeat terrorism."" —Hillary",35438,35553
302,"""We will not build a wall—instead, we will build an economy where everyone who wants a good job can get one."" —Hillary",35554,35672
303,FDR came up with the perfect rebuke to Donald Trump more than 80 years ago: “The only thing we have to fear is fear itself.”,35673,35797
304,"""He's taken the Republican Party a long way, from 'Morning in America’ to 'Midnight in America.’” —Hillary on Trump",35798,35913
305,"""We heard Donald Trump’s answer last week at his convention. He wants to divide us...He wants us to fear the future and fear each other.""",35914,36051
306,“We have to decide whether we’re going to work together so we can all rise together.” —Hillary,36052,36146
307,"""Our Founders embraced the enduring truth that we are stronger together.” —Hillary",36147,36229
308,"“@BernieSanders, you’ve put economic and social justice issues front and center where they belong.” —Hillary https://t.co/KZP2ohDTYD",36230,36362
309,"""To all of your supporters here and around the country: I want you to know, I've heard you."" —Hillary on @BernieSanders",36363,36482
310,"""I want to thank Bernie Sanders. Bernie, your campaign inspired millions of Americans.” —Hillary",36483,36579
311,"""For those of you out there who are just getting to know @TimKaine...he'll make the whole country proud as our vice president."" —Hillary",36580,36716
312,"""We heard from…@JoeBiden. He spoke from his big heart about our party’s commitment to working people."" —Hillary https://t.co/PHHCeD7YYh",36717,36852
313,"""America is stronger because of President Obama's leadership, and I am better because of his friendship."" —Hillary https://t.co/d1Kv4iUHqo",36853,36991
314,"“We heard the man from Hope, Bill Clinton. And the man of hope, Barack Obama.” —Hillary https://t.co/vH9fNuJQFP",36992,37103
315,"""Bill, that conversation we started in the law library 45 years ago, it is still going strong.” —Hillary",37104,37208
316,"""Chelsea, thank you. I am so proud to be your mother and so proud of the woman you’ve become."" —Hillary",37209,37312
317,"""Regardless of what was happening in her life, she was always, always there for me.” —@ChelseaClinton https://t.co/nuIjrwZC1M",37313,37438
318,"""Mom, Grandma would be so, so proud of you tonight.” —@ChelseaClinton",37439,37508
319,"“This November, I’m voting for a woman…who knows women’s rights are human rights…here at home and around the world.” —@ChelseaClinton",37509,37642
320,"""People ask me all the time: How does she do it?…Here’s how: It’s because she never, ever forgets who she’s fighting for.” —@ChelseaClinton",37643,37782
321,"""She always feels like there isn’t a moment to lose because she knows that for that mother, for that family, there isn’t.” —@ChelseaClinton",37783,37922
322,So proud. https://t.co/ketX6fS9NY,37923,37956
323,"""I’m here as a proud American, a proud Democrat, a proud mother, and tonight, in particular, a very, very proud daughter.” —@ChelseaClinton",37957,38096
324,Getting ready. https://t.co/9ik6n738DO,38097,38135
325,"""That's right—I love Hillary too."" —@KatyPerry https://t.co/N2OI27Go7k",38136,38206
326,About to head out and accept your nomination for president. I’m so grateful to everyone who made this moment possible. -H,38207,38328
327,Get the latest from the #DemConvention floor before Hillary takes the stage: https://t.co/uRJ6D4F7TU,38329,38429
328,Watch live: Get an exclusive look at the @DemConvention before Hillary officially accepts the nomination → https://t.co/XGg70hpYLL,38430,38560
329,"""Some issues are not left vs. right or liberal vs. conservative, they are right vs. wrong."" —Rev. William Barber https://t.co/LRZRS9Qmqu",38561,38697
330,"""When Flint's water poisons its children, it hurts all of us. These are our children."" —@JenGranholm https://t.co/9MCjMKaLQQ",38698,38822
331,A night we'll never forget. https://t.co/BOq4CziQsC,38823,38874
332,"""That's a bunch of malarkey!"" —@JoeBiden, holding exactly nothing back last night. https://t.co/wsAbCgmljy",38875,38981
333,"""I'm living through history, and my mom and my grandma are finally getting to see it as well."" —Ebony, 21, NC https://t.co/BKe7YtwquO",38982,39115
334,It's all happening. Tune in for an exclusive look at the #DemsInPhilly as Hillary officially accepts the nomination. https://t.co/1Yu5RPLzVb,39116,39256
335,“Her words gave me strength during one of the toughest tests of my life.” —@Clairecmc on Hillary https://t.co/LeiYRzGleD,39257,39377
336,You better listen to @RepCleaver — @HillaryClinton won't stay throwed. #DemsInPhilly https://t.co/QUadl02GPz,39378,39486
337,"“Al igual que Hillary... he luchado toda mi vida por los derechos humanos, mujeres, trabajadores” —@DoloresHuerta. https://t.co/fPMb3277J3",39487,39625
338,Thanks to all who watched and all who fight for LGBT rights. Here are my #DemConvention remarks! #DemsInPhilly https://t.co/ZIcE52ZuZd,39626,39760
339,It was the honor of my life to accept the Democratic nomination for vice president. I won't let you down. https://t.co/91PGJKVsHU,39761,39890
340,Watch Michael Bloomberg sum up a whole lot about that's wrong with Donald Trump in less than a minute: https://t.co/KbMtJkr3h9,39891,40017
341,"""No matter how daunting the odds; no matter how much people try to knock her down, she never, ever quits."" —@POTUS https://t.co/oJ2rKzubWY",40018,40156
342,Ready to pass the baton. https://t.co/a0hKQcWDzq,40157,40205
343,"On day three, the #DemsInPhilly officially welcomed @TimKaine to the ticket—and @POTUS brought down the house: https://t.co/gs5u7BjPzg",40206,40340
344,"""I ask you to do for Hillary Clinton what you did for me. I ask you to carry her the same way you carried me.” https://t.co/61muVG6Ysj",40341,40475
345,To: @POTUS From: All of us https://t.co/swH52dLR6f,40476,40526
346,"We love you back, @POTUS. https://t.co/S3dEsjwXCo",40527,40576
347,"""Thank you for this incredible journey. Let’s keep it going. God bless the United States of America!"" —@POTUS https://t.co/pgv3aUXdle",40577,40710
348,"""I’m asking you to join me, to reject cynicism...to summon what’s best in us; to elect Hillary Clinton as the next president” —@POTUS",40711,40844
349,"""America, you have vindicated that hope these past eight years. And now I’m ready to pass the baton.” —@POTUS",40845,40954
350,"“You’re who I was talking about twelve years ago, when I talked about hope.” —@POTUS",40955,41039
351,"""Tonight, I ask you to do for Hillary Clinton what you did for me. I ask you to carry her the same way you carried me.” —@POTUS",41040,41167
352,"""We don’t fear the future; we shape it, we embrace it, as one people, stronger together than we are on our own.” —@POTUS",41168,41288
353,“Democracy isn’t a spectator sport. America isn’t about 'yes he will.' It’s about 'yes we can.’” —@POTUS,41289,41393
354,"""Hillary Clinton is that woman in the arena. She’s been there for us, even if we haven’t always noticed."" —@POTUS",41394,41507
355,"""There has never been a man or a woman more qualified than Hillary Clinton to serve as president."" —@POTUS https://t.co/5xI4BTop7Y",41508,41638
356,"""We all need to get out and vote for Democrats up and down the ticket, and then hold them accountable until they get the job done.” —@POTUS",41639,41778
357,"""Democracy works, America, but we gotta want it—not just during an election year, but all the days in between.” —@POTUS",41779,41898
358,“The American Dream is something no wall will ever contain.” —@POTUS,41899,41967
359,"""She knows that for progress to happen, we have to listen to each other, and see ourselves in each other.” —@POTUS on Hillary",41968,42093
360,"""America has never been about what one person says he’ll do for us. It’s always been about what can be achieved by us, together.” —@POTUS",42094,42231
361,"""That’s who we are. That’s our birthright. The capacity to shape our own destiny."" —@POTUS",42232,42322
362,"""Ronald Reagan called America 'a shining city on a hill.' Donald Trump calls it 'a divided crime scene' that only he can fix.'"" —@POTUS",42323,42458
363,"""America is already great. America is already strong &amp; I promise you, our strength, our greatness, does not depend on Donald Trump.” —@POTUS",42459,42603
364,"""Meanwhile, Donald Trump calls our military a disaster…he suggests America is weak.” —@POTUS",42604,42696
365,"""She is fit and she is ready to be the next Commander-in-Chief.” —@POTUS on Hillary",42697,42780
366,"""I know Hillary won’t relent until ISIL is destroyed.” —@POTUS",42781,42843
367,"""Hillary Clinton is respected around the world, not just by leaders, but by the people they serve.” —@POTUS",42844,42951
368,"“Then there’s Donald Trump. He’s not really a plans guy, not really a facts guy either.” —@POTUS",42952,43048
369,"""Don't boo, vote!” —@POTUS https://t.co/xahMq2sU1q",43049,43099
370,"“Tim Kaine is as good a man, as humble and committed a public servant, as anyone I know. He will be a great vice president.” —@POTUS",43100,43232
371,“There has never been a man or a woman more qualified than Hillary Clinton to serve as president of the United States of America.” —@POTUS,43233,43371
372,"""No matter how daunting the odds. No matter how much people try to knock her down. She never, ever quits."" —@POTUS on Hillary",43372,43497
373,“She sat with me in the Situation Room and forcefully argued in favor of the mission that took out Osama bin Laden” —@POTUS on Hillary,43498,43632
374,“Nothing truly prepares you for the demands of the Oval Office…but Hillary’s been in the room; she’s been part of those decisions.” —@POTUS,43633,43772
375,"“She was doing everything I was, but just like Ginger Rogers, it was backwards in heels.” —@POTUS on the 2008 election",43773,43891
376,"“A leader with real plans to break down barriers,...the next president of the United States Hillary Clinton.” —@POTUS",43892,44009
377,"""What I see is Americans of every party, every background, every faith who believe that we are stronger together.” —@POTUS",44010,44132
378,"“As I’ve traveled this country…what I’ve also seen, more than anything, is what is right with America.” —@POTUS",44133,44244
379,"""The America I know is full of courage, and optimism, and ingenuity. The America I know is decent and generous.” —@POTUS",44245,44365
380,“What we heard was a deeply pessimistic vision of a country where we turn against each other.” —@POTUS on last week’s GOP convention,44366,44498
