,sentence,start,end
0,The choice on climate change couldn't be more stark: https://t.co/K745PdjVmW. https://t.co/us7OyJcdx4,0,101
1,It's not just a value—it's a real plan. https://t.co/OvGzoPTtwg https://t.co/hI6Ip27HHm,102,189
2,.@HillaryClinton hits the Trump Loophole - his backdoor tax break for billionaires like himself. Read about it here: https://t.co/35R3aVlCfV,190,330
3,Let’s go out and build the future. https://t.co/OvGzoPTtwg,331,389
4,"""One of the reasons I asked Tim Kaine to be my running mate is that he...has a record of working across the aisle."" https://t.co/CNwtLVWl8n",390,529
5,"Strengthening unions doesn’t just serve their members—it leads to better pay, benefits, and working conditions for all employees.",530,659
6,"Trump wants to give trillions in tax breaks to people like himself. Instead, let’s invest in our veterans, kids, schools and police.",660,792
7,The 400 richest taxpayers in America would get an average tax cut of more than $15 million a year from the Trump loophole.,793,915
8,Trump wants to eliminate the estate tax. What that would mean: his family gets a $4 billion tax cut. 99.8% of Americans get nothing.,916,1048
9,"Trump would give trillions in tax cuts to big corporations, millionaires, and Wall Street money managers. https://t.co/tymag0QkLx",1049,1178
10,Multi-millionaires should not be able to pay a lower tax rate than their secretaries: https://t.co/XFX93S1Vgh,1179,1288
11,"Every employee, from the CEO suite to the factory floor, contributes to a business’ success, so everybody should share in the rewards.",1289,1423
12,One positive thing Trump could do to make America great again? Actually make great things in America: https://t.co/lg8Xqwblam,1424,1549
13,"If @TeamUSA was as fearful as Trump, Michael Phelps and Simone Biles would be cowering in the locker room. America isn’t afraid to compete.",1550,1689
14,"Trump may talk a big game on trade, but his approach is based on fear, not strength—fear that we can’t compete with the rest of the world.",1690,1828
15,"""As president, I will stand up to China and anyone else who tries to take advantage of American workers and companies."" —Hillary",1829,1957
16,We’re going to invest in union training programs and apprenticeship programs so you can earn while you learn: https://t.co/sbbiIqIz0c,1958,2091
17,"A four-year degree shouldn’t be the only path to a good job. You should be able to learn a skill, practice a trade, and make a good living.",2092,2231
18,"It’s not right that Donald Trump can ignore his debts, but students and families can’t refinance theirs.",2232,2336
19,Let’s fight to make college tuition-free for the middle class and debt-free for everyone: https://t.co/BNZJ6ScplY,2337,2450
20,"The people taking care of our children and our parents deserve a good wage, good benefits, and a secure retirement.",2451,2566
21,Donald Trump has spent his whole career stiffing small businesses. https://t.co/i51CBQ9lKM,2567,2657
22,We’re going to invest $10 billion in “Make it in America” partnerships to support American manufacturing: https://t.co/21iaJ5hq7X,2658,2787
23,"""Some country is going to be the clean energy superpower of the 21st century and create millions of jobs...I want it to be us."" —Hillary",2788,2924
24,"Starting on day one, we will work with both parties to pass the biggest investment in new, good-paying jobs since World War II.",2925,3052
25,One of the many stark choices we face in this election. https://t.co/sCQJXB7mEV,3053,3132
26,"Every American willing to work hard should be able to find a job that provides dignity, pride, and decent pay that can support a family.",3133,3269
27,"We are resilient, determined, and hard-working. There’s nothing America can’t do if we do it together.",3270,3372
28,"When Trump visited Detroit on Monday he talked only of failure, poverty, and crime. He’s missing so much about what makes Michigan great.",3373,3510
29,Hillary is speaking live from Detroit on the economy. Don’t miss it. Tune in now: https://t.co/YgVauYf0Ol,3511,3616
30,"Anyone willing to sink so low, so often should never be allowed to serve as our Commander-in-Chief.",3617,3716
31,"No, Barack Obama is not the founder of ISIS.",3717,3761
32,"It can be difficult to muster outrage as frequently as Donald Trump should cause it, but his smear against President Obama requires it.",3762,3897
33,Donald Trump’s tax plan mostly helps...Donald Trump. And people like him at the top. https://t.co/5luTzXmZDP,3898,4006
34,1979. https://t.co/VYTglhPyfO,4007,4036
35,"Unlike Donald Trump's, our campaign is about issues—not insults. https://t.co/puVZP5iFRE https://t.co/pB0DcV1TeP",4037,4149
36,My heart breaks for the family of the officer killed in Arkansas today. Grateful for his service to his community. -H,4150,4267
37,Our kids see the president as a role model. How will they see Donald Trump? https://t.co/xOxe3LdL70,4268,4367
38,"Who benefits from Donald Trump's ""new"" economic plan? Rich people like Donald Trump. https://t.co/fDTcHhgCbz",4368,4476
39,"Young people face tough challenges, but they have the ability to do something about it: Vote. https://t.co/dm98k71nf1",4477,4594
40,We're also going to make sure future generations inherit a cleaner planet—and create millions of jobs along the way. https://t.co/HvrbycAnAy,4595,4735
41,Let's make it easier for young people to start businesses and fulfill their dreams. https://t.co/cJzNCnaahh https://t.co/vZHW9VZKDT,4736,4867
42,"And, unlike @realDonaldTrump, we're gonna make it easier for people who *aren't* celebrities to get apprenticeships. https://t.co/SdCUIITwuY",4868,5008
43,Young Americans have the most to gain from Hillary's economic plan—and the most to lose under Trump's policies. https://t.co/V1u6kLTjNy,5009,5144
44,"When you dig deeper, you see that young people of color have faced even greater challenges. That has to change. https://t.co/8mpMkHn2sH",5145,5280
45,Young people were among the hardest hit during the great recession—and the effects still linger. https://t.co/XFIZKrCHxF,5281,5401
46,Imagine how you'll feel the day after the election if we haven't joined together to chart a course of optimism. https://t.co/tTgeqxNqYm,5402,5537
47,"""I am humbled and moved by the Republicans who are willing to stand up and say that Donald Trump does not represent their values.” —Hillary",5538,5677
48,"Donald Trump has spent his career stiffing small businesses, refusing to pay them what they’re owed. https://t.co/un2YiRLEYF",5678,5802
49,"“When they have student debt, we’ll put a three year moratory on that so they can start their own businesses!”—@HillaryClinton",5803,5929
50,We can be the clean energy superpower of the 21st Century. https://t.co/Zb8w0tLYkS,5930,6012
51,We are living off of the infrastructure built by our parents and grandparents. It’s overdue for upgrades: https://t.co/KjhFN0QS2c,6013,6142
52,We’re going to make the biggest investment in good-paying jobs since World War II: https://t.co/NC6FHkl53y,6143,6249
53,Hillary's talking about the economy in Des Moines. Tune in now to watch: https://t.co/5VPr9qVgkv,6250,6346
54,"If you're a millionaire, you'll do great under Trump's economic plan. Everyone else? Well... Take a look: https://t.co/zavnOS2RdL",6347,6476
55,"""The time has come for Republicans...to repudiate Mr. Trump once and for all."" —@nytimes https://t.co/yMKCpKMC4l",6477,6589
56,David's letter to his daughter about why he can't support Donald Trump really hits home. https://t.co/uyDaDdcpab,6590,6702
57,"Our kids are watching, Donald. https://t.co/yRnhmfHIWh",6703,6757
58,".@realDonaldTrump might astound Americans on a routine basis, but we must draw a line between political speech &amp; suggestions of violence.",6758,6899
59,"Welcome back, Madame Secretary. Hillary heads back to Des Moines this Wednesday. RSVP: https://t.co/cwo0OodC6J. https://t.co/OINTxv21hB",6900,7035
60,"""A person seeking to be the President of the United States should not suggest violence in any way."" https://t.co/Uu55CBCqdK",7036,7159
61,Here’s the sad truth: There is no other Donald Trump. This is it. https://t.co/XNDh0d5csA,7160,7249
62,How can we prevent the spread of Zika in the U.S.? Hillary and @TimKaine respond on @Quora: https://t.co/ncuMmTCrSN https://t.co/ZeQOgVVxhX,7250,7389
63,Donald Trump's economic plan is a bad deal for working families—and a big tax cut for Donald Trump. https://t.co/D0oOe6bwza,7390,7513
64,Trump's trickle-down economic plan: big giveaways for those at the top at the expense of everyone else. https://t.co/rXg4m7ulg4,7514,7641
65,Thank you to the more than 2 million people who have donated to this campaign. Chip in now to join them: https://t.co/r3sF3mwlFX,7642,7770
66,50 GOP officials sign a letter declaring that Trump “would be the most reckless president in American history” https://t.co/QglcBt9uog,7771,7905
67,Presidential &amp; VP candidates @HillaryClinton &amp; @timkaine are now answering in their Session! https://t.co/jVxzCWBXX3 https://t.co/t6RSgkzAMJ,7906,8054
68,Even @realDonaldTrump's childcare plan gives billionaires w/ a nanny a tax break while millions of low-income households get nothing.,8055,8188
69,.@realDonaldTrump's econ plan was written by rich corporate insider advisors to make the economy even greater for rich corporate insiders.,8189,8327
70,"Last night, swimmer @KatieLedecky won gold and broke her own world record in the 400m freestyle. Congrats, Katie! https://t.co/db79swBbOr",8328,8465
71,Just imagine Donald Trump in the Oval Office facing a real crisis. We can’t afford that kind of risk.,8466,8567
72,Donald Trump is not only putting our national security at risk—he’s putting our economy at risk. https://t.co/HMiJtadxMF,8568,8688
73,We’re going to make sure the wealthy pay their fair share in taxes for a change: https://t.co/p7J6Ab1Agq,8689,8793
74,Donald Trump's plan is just a repackaging of trickle-down economics—and it doesn’t help our economy or the vast majority of Americans.,8794,8928
75,We've got to stand up against climate deniers. There isn't a problem we can't solve if we put our minds to it: https://t.co/2KQRq50PP8,8929,9063
76,"Watch live as Hillary stops in St. Petersburg, Florida, for a campaign rally on the choice we face on the economy: https://t.co/09cW39nHXo",9064,9202
77,Answer by @HillaryClinton on her plans for her first 100 days in office if elected https://t.co/RQ50LwbmMU https://t.co/I8eEK6bkkv,9203,9333
78,"Here's what people with actual ""tremendous business success"" say about Donald Trump. https://t.co/0T22CRcy2V",9334,9442
79,.@realDonaldTrump has an economic plan...to cut the pay of hardworking UAW members. https://t.co/IhIohjOtwq #NeverTrump,9443,9562
80,"Creating jobs — it's what Democrats do. In 3 months, let's elect another one: https://t.co/qvnYQxtH0A https://t.co/ywlFN9AOdB",9563,9688
81,"At a time of massive income and wealth inequality, it is absurd to provide huge tax breaks to the very rich.",9689,9797
82,"""Clinton’s economic policies...will result in a stronger U.S. economy.” —Mark Zandi, John McCain's economic advisor https://t.co/eLL6iQNEWY",9798,9937
83,Today's bombing of a hospital in Pakistan is despicable. We have to stand up against terror and come together to prevent these attacks. -H,9938,10076
84,"In Rio, Olympic fencer Ibtihaj Muhammad became the first American Muslim athlete to compete while wearing a hijab. https://t.co/OrRSHnH2Ra",10077,10215
85,"When you're comparing Hillary's and Trump's economic plans, there are two numbers you need to know. https://t.co/GdanBYOMUz",10216,10339
86,"""I don't know another businessman that brags about his bankruptcies."" —@WarrenBuffett on Trump: https://t.co/Jx2p1D6UAd",10340,10459
87,Donald Trump's economic plan: 1. Lower wages 2. Fewer jobs 3. More debt 4. Tax breaks for the 0.1% https://t.co/OLU4htKlcV,10460,10582
88,WATCH: This special 360 degree video allows you to experience the magic of the @DemConvention balloon drop: https://t.co/5DbAXK9yb8,10583,10714
89,"""She doesn't just see one America. She sees all of America &amp; knows that we need all of us."" —@CoryBooker on Hillary https://t.co/EgkawPBAta",10715,10858
90,We have some questions about @realDonaldTrump's cozy relationship with Russia. https://t.co/aetHzJyJCo,10859,10961
91,"In America, if you can dream it, you should be able to build it. https://t.co/xduxyCcwj3",10962,11050
92,We're live on Facebook giving a demo of our Hillary for America mobile app. Tune in to get an inside look: https://t.co/0wuPE0hMcL.,11051,11182
93,"The NRA is based in Virginia, but that's never stopped @TimKaine from leading the fight to reduce gun violence. https://t.co/J9F086bQmo",11183,11318
94,"No one wants to earn a Purple Heart. But to those who did, you have America's unending gratitude and admiration. Thank you. #PurpleHeartDay",11319,11458
95,"Donald Trump's no good, horrible, very bad week. https://t.co/MtgwywgJ3q",11459,11531
96,Laurie Hernandez is the first U.S.-born Latina on the Olympic gymnastics team since '84. Good luck! #ImWithHernandez https://t.co/C1S688jCt6,11532,11672
97,Proud to celebrate Nat. Purple Heart Day today. Thank you to my fellow vets &amp; service members for your sacrifice. https://t.co/C7ZqjhImS5,11673,11814
98,"In honor of our Weekend of Action, read why Jasmine Smalls (@ajazzyworld) is a proud member of Team #VirWINia. https://t.co/zomeZ1wXgY",11815,11949
99,"""She will deliver on the most important duty of a president—keeping our nation safe."" —Michael Morell on Hillary https://t.co/zmI3BOCH9Y",11950,12086
100,"Three-time world all-around champion @Simone_Biles is set to make history at the Olympics. Good luck, Simone! https://t.co/JkiQ8hc1Xt",12087,12220
101,"“On the issues, there’s no comparison in terms of thoughtfulness, thoroughness, and practicality."" —@HoustonChron https://t.co/hcFQLBYJfS",12221,12358
102,"So proud of you, Karla. https://t.co/iSQBiY8PyA",12359,12406
103,“#sendDonaldtospace” —@JeffBezos Trump's peer reviews are dismal: https://t.co/AC4zW7KhrH,12407,12496
104,45 reasons why Trump should never be president—just from this week alone. https://t.co/0cJ6fQeepR,12497,12594
105,"Seriously, what is going on with Trump and Russia? https://t.co/N6ySNILYMx",12595,12669
106,"This is what I saw while photographing @HillaryClinton, @POTUS and more at the #DemConvention. https://t.co/jY0RO1XNJX",12670,12788
107,"The right to vote is at the heart of our democracy, and a weakened VRA threatens that right for too many. It's time to #RestoreTheVRA.",12789,12923
108,Why the @HoustonChron is urging voters to support Hillary in the “starkest political choice in living memory”: https://t.co/phjf19ybXr,12924,13058
109,Why do Trump’s foreign policy ideas read like a Putin wish list? https://t.co/IrJqXq0Kfg,13059,13147
110,Four years ago today. https://t.co/WPM1I9PPN3,13148,13193
111,"… so yeah, it's been quite a week for Donald Trump. https://t.co/UsexFeJjtl",13194,13269
112,Here's the story behind our campaign's first braille button: https://t.co/xbiY2gaPB5.,13270,13355
113,"Deeply concerned by raid on #ugpride2016. Many detained, incl. @Frankmugisha. LGBT citizens deserve protection. https://t.co/x1mlavJOvL",13356,13491
114,"America is stronger when we expand access to the ballot box, not restrict it. It's time to #RestoreTheVRA. https://t.co/uId57oQgUn",13492,13622
115,"Four gold medals and counting: Today, @SerenaWilliams hits the court in Rio to add to her collection. https://t.co/iOMV0FH38S",13623,13748
116,"At the Paris 1900 games, golfer Margaret Abbott became the first American woman to win an Olympic gold medal. https://t.co/kT9jIHvVu8",13749,13882
117,Ready for the opening ceremony. U.S.A! U.S.A! https://t.co/zcDofsiIcJ,13883,13952
118,Trump just said he “doesn’t throw babies out” of his rallies... Let’s review the record. https://t.co/u3a8RDNNrr,13953,14065
119,"""We have never had a candidate that was more qualified to take the office of president."" —@POTUS on Hillary https://t.co/EJ9xI5VQK7",14066,14197
120,America is going to see what VP Biden already knows — just how much @HillaryClinton cares about our country. https://t.co/OakQ0Yhw0l,14198,14330
121,"This week, Trump attacked a fallen soldier's family, called Hillary ""the devil,"" and criticized a crying baby. https://t.co/UsexFf0UkT",14331,14465
122,Stronger Together comes out in Sept—a book on Hillary's policy plans and vision for America: https://t.co/okQWnu725t https://t.co/lzyuvRstpt,14466,14606
123,Republicans agree: We can't give Donald Trump control of our nuclear codes. https://t.co/aVB6e5GbSm,14607,14706
124,"""We have to reject and stand up against the appeals to the kind of bigotry...that we see from Trump’s campaign."" —Hillary #NABJNAHJ16",14707,14840
125,“Él dice que no se puede confiar en un distinguido juez porque tiene herencia mexicana”—Hillary sobre Trump.,14841,14949
126,"We launched an all-Spanish Twitter account, @Hillary_esp, because we believe in bringing as many people as possible into this conversation.",14950,15089
127,“I believe with all my heart that America is better than this. America is better than Donald Trump.” —Hillary,15090,15199
128,"Trump retweets white nationalists. He talks about banning Muslims. And yes, he talks about curtailing press freedom as well.",15200,15324
129,Trump is harkening back to the most shameful chapters of our history and appealing to the ugliest impulses of our society.,15325,15447
130,"It’s past time for comprehensive immigration reform, and we’re going to do everything we can to get it done: https://t.co/M3doGLY5rL",15448,15580
131,"We’ve got to help every family afford the books, computers, and internet access that our kids need to learn in the 21st century.",15581,15709
132,Rosa Parks opened up every seat on the bus. Now we’ve got to expand economic opportunity so everyone can afford the fare.,15710,15831
133,"The Great Recession hit our whole country hard, but the toll was especially hard on black and Latino families.",15832,15942
134,Tune in to watch Hillary speak live with the @NABJ and the @NAHJ: https://t.co/nNYrAM60IC,15943,16032
135,"""Trump is not only unqualified for the job, but he may well pose a threat to our national security."" —Michael Morell https://t.co/zmI3BOCH9Y",16033,16173
136,Good news: Our businesses have added 15 million jobs over the past 77 months → https://t.co/C8P76l6bVB https://t.co/p0SH7Jne5n,16174,16300
137,Our first-ever gold medal-winning women's gymnastics team: the Magnificent Seven. https://t.co/MVkhHBh7hI,16301,16406
138,We don't know why Trump and Putin praise each other so much and share many foreign policies. We'll let you guess. https://t.co/N6ySNJ3zE5,16407,16544
139,Watch an exclusive interview with @POTUS backstage at the Democratic Convention. https://t.co/EJ9xI5Eflx,16545,16649
140,"None of us can raise a family, build a business, heal a community, or lift a country alone. It takes a village. https://t.co/wOdhhdd0pb",16650,16785
141,"We know a guy with a binder, @realDonaldTrump. (He might not take your calls, though.) https://t.co/dxmFcISmaz",16786,16896
142,"Obama on whether Trump could be trusted with US nuclear weapons: ""Make your own judgment"" https://t.co/6OZtrfIwim https://t.co/Nj20PaXF2o",16897,17034
143,"Obama: ""I obviously have very strong opinions about the two candidates running. One is very positive. The other one is not so much.""",17035,17167
144,Wish @POTUS a happy birthday. Sign his card: https://t.co/YroKwbRvYX,17168,17236
145,"You saw the Democratic Convention. Now, watch the never-before-seen footage from backstage: https://t.co/mMjJFr02Wk",17237,17352
146,"""If you're not registered, and you're eligible as an American citizen, please go sign up."" —Hillary in Nevada: https://t.co/tTgeqxNqYm",17353,17487
147,Anyone who you can provoke with a tweet should not be anywhere near nuclear weapons: https://t.co/NLP0SRnuYt,17488,17596
148,"Donald Trump is not qualified to be president, and he is temperamentally unfit to be Commander-in-Chief.",17597,17701
149,"""We're going to work to make the biggest investment in new, good-paying jobs since World War II"" —Hillary https://t.co/6v6XcdsZYa",17702,17831
150,"Every week, @realDonaldTrump hits a new low. https://t.co/LBrTdE2n7v",17832,17900
151,Most of Trump's merchandise is MADE IN (just about everywhere except) THE USA. https://t.co/A0d7fxyzXx,17901,18003
152,"""That’s what 21st century feminism is about: The idea that when everybody is equal, we are all more free."" —@POTUS https://t.co/6Ou7XEOE3j",18004,18142
153,What our economy needs: The largest investment in creating good-paying jobs since World War II. https://t.co/uDdkrA2myo,18143,18262
154,"Happy birthday, @POTUS. https://t.co/5u1HAPnDI9",18263,18310
155,The @HoustonChron almost always backs the GOP nominee for president. Here’s why they endorsed Hillary in 2016: https://t.co/l2AYf74YS4,18311,18445
156,We have the most productive and competitive workers in the world. We just need to give them a chance to succeed. https://t.co/kSFXLOTkMj,18446,18582
157,"""I will take on the gun lobby for commonsense gun safety reform.” —Hillary: https://t.co/TVwy0XqOKH",18583,18682
158,We are setting a goal to register 3 million more American citizens to vote: https://t.co/eLBTOMvqvk,18683,18782
159,As president I will defend and protect America’s public lands. https://t.co/Jb7DXwL9WS,18783,18869
160,Anyone who can be provoked by a tweet shouldn’t be anywhere near nuclear weapons.,18870,18951
161,"""There is no doubt in my mind that Donald Trump is unqualified and unfit to be Commander-in-Chief.” —Hillary",18952,19060
162,"The RNC showed a negative, pessimistic view of America: That is not who we are. Do we have challenges? Sure. Can we meet them? Absolutely!",19061,19199
163,"""We gotta make this economy work for everybody, not just those at the top.” —Hillary https://t.co/xUQEFdxnWO",19200,19308
164,"""I was Capt. Khan’s commander in Iraq. The Khan family is our family."" https://t.co/Y1myW1WGjN via @PostOpinions",19309,19421
165,"Trump: ""I love war, in a certain way."" https://t.co/fnY9NFRE3R",19422,19484
166,"Trump thinks it's too hard to make his products in America, so we went and found 100 US manufacturers he could use. https://t.co/FCUCLJb1nr",19485,19624
167,Donald Trump's message to workers: You're fired. https://t.co/Fut2urP8nZ,19625,19697
168,Making our economy work for everyone starts by making sure those at the top pay their fair share in taxes. https://t.co/uDdkrzKL9O,19698,19828
169,"If Trump is serious about ""making America great again,"" he should start by making his products in America. https://t.co/1VVoUbgAn3",19829,19959
170,"Lincoln: ""War, at its best, is terrible."" Trump: ""I love war."" How Trump's words compare to former presidents': https://t.co/FFykARMR8m",19960,20095
171,22 memorable moments from the Democratic Convention that you probably missed: https://t.co/xnvFiEKlJC https://t.co/bLqoDfFfvc,20096,20221
172,Just 98 days until Election Day. Here are 98 things that depend on the choice we make on November 8: https://t.co/RDRCEOJ4N4,20222,20346
173,".@realdonaldtrump, this is how one usually looks when you are awarded the Purple Heart. Nothing easy about it. https://t.co/K59HLnzmhK",20347,20481
174,An important step forward on pay equity in Massachusetts. Women deserve equal pay across our nation. https://t.co/s560mVbiGQ,20482,20606
175,"No, this seriously happened... https://t.co/kAptsQAWR1",20607,20661
176,"First Trump attacked the Hotel Roanoke. Then a Gold Star VA family. Today, he kicked a baby out of a VA rally. Virginia is not for haters!",20662,20800
177,"Under Trump, our economy would lose 3.5 million jobs. Hillary's plan would create 10.4 million—in one term alone. https://t.co/MsVrIdXbDF",20801,20938
178,All Kauveri wanted for her seventh birthday was to meet Hillary (and a Star Wars Lego set). She got both! https://t.co/d0yNvue7LH,20939,21068
179,"President Obama strongly rebukes Donald Trump: He is ""unfit to serve as president"" https://t.co/tFiDnVuOD4 https://t.co/AeentEOpfq",21069,21199
180,This from a man who says he’s “sacrificed” for our country. https://t.co/oId7LJdrx8,21200,21283
181,"The #DemConvention painted a bright picture of America—filled with diversity, love &amp; hope. The RNC was...different. https://t.co/Vo71rzElsE",21284,21427
182,12 moments from the past week that will make you proud to be a Democrat: https://t.co/rNqHyg5CrL,21428,21524
183,Wonderful: Men at #DemConvention describe what electing a woman president means to them https://t.co/zrGQJ3bgGw #ImWithHer,21525,21647
184,".@realDonaldTrump, when someone puts in the work, you are supposed to pay them. https://t.co/fDVl1mWxrU",21648,21751
185,"A former McCain advisor says Hillary's policies ""will result in a stronger U.S. economy under almost any scenario."" https://t.co/TGh3Zy5ndP",21752,21891
186,"Barack, Michelle, Joe, Bernie, Elizabeth, Bill, Tim, Hillary, and more: Watch the best moments from the DNC. https://t.co/EWJr9oXweD",21892,22024
187,Road trip: Tag along on Hillary and @TimKaine's bus tour through Ohio and Pennsylvania → https://t.co/oA2spAUmu9 https://t.co/xj3HOYaFBc,22025,22161
188,Trump wants to be our Commander-in-Chief. Here's how he's treated veterans thus far: https://t.co/iquFJ676Rj,22162,22270
189,"JUST IN: World's 4th richest person, Warren Buffett, challenges Trump to release his taxes. ""I'm under audit too."" https://t.co/L9BgMOYuw2",22271,22409
190,Cheryl's husband died serving our country. Trump's company scammed her out of money she needed for her family. https://t.co/gfMeiJZ3DW,22410,22544
191,.@IAFFLocal5 responds to @realDonaldTrump attack over the weekend. @LauraWalkerKC @JakeSherman @TheFix https://t.co/DIU8kYDItp,22545,22671
