,sentence,start,end
376,So who exactly is advising Trump on foreign policy? https://t.co/OVMdxGT736,45190,45265
377,Today is @BillClinton's birthday! It's not too late to sign his card here: https://t.co/30Uxor2066,45266,45364
378,Why do Trump and Putin keep saying all the same things? (Hint: It's not Manafort.) https://t.co/OVMdxHaHUE,45365,45471
379,"The flooding in Louisiana is worse than anyone expected, and they need our support. Here's how you can help: https://t.co/nihT10OvRk",45472,45604
380,"Clinton and Trump are confirmed to participate in a ""Commander-in-chief"" forum with @IAVA on @MSNBC September 7th https://t.co/jjh1Qxgp88",45605,45742
381,"45 years later, I couldn’t be happier to have you by my side. Happy birthday, Bill! -H https://t.co/KDhgLsNr7K",45743,45853
382,Priorities. https://t.co/vcpYClUtxw https://t.co/H9ULZ9f9Hg,45854,45913
383,I was honored to be a part of history at the DNC. Hillary Clinton is an inspiration for women everywhere. https://t.co/EtaG8tRgEf,45914,46043
384,Hillary’s college plan will bring about a long-awaited transformation of higher education in America. Here's how: https://t.co/YX1niM3brQ,46044,46181
385,"News from Miami Beach highlighting urgency of the Zika crisis, a public health emergency. Congress needs to act now. https://t.co/AFWl5KmjvW",46182,46322
386,"Congrats to @usatf's @Bri_Rollin, @ItsPooda, and @KristiHollywood on their historic podium sweep last night. https://t.co/K0vkob8BOc",46323,46455
387,Glad to see that the Justice Department is ending the use of private prisons. This is the right step forward. -H https://t.co/5IxHvGULtR,46456,46592
388,"Even after the 19th was ratified, women of color battled to get to vote. #RosanellEaton had to take a literacy test. https://t.co/7X4uJIar6S",46593,46733
389,Donald Trump wants to eliminate the estate tax. Doing so could save his family $4 billion and 99.8% of families $0. https://t.co/iEjXi24GGR,46734,46873
390,"Donald Trump promised to release his tax returns if he ran for office. Now? ""It's none of your business."" https://t.co/ihL7TlW0Xh",46874,47003
391,Hillary's first job was fighting for social justice at @ChildDefender—it's one of the things I admire most about her https://t.co/txYVVcgKyR,47004,47144
392,"""@Wired sees only one person running for president who can do the job: Hillary Clinton."" https://t.co/SQ7hsOaHyl",47145,47257
393,Don't waste it. Make sure you're registered to vote: https://t.co/tTgeqy51PU https://t.co/XA0iPATVmR,47258,47358
394,Donald Trump's plan: a multi-billion dollar tax cut for himself and the wealthiest Americans https://t.co/he2KkNcaMm,47359,47475
395,"We know that giving millionaires huge tax breaks doesn't help our economy. So why would we try it again, Donald? https://t.co/Js7FhLOZxW",47476,47612
396,"Does Trump actually pay his fair share in taxes? Until he releases his tax returns, voters won't know for sure. https://t.co/UrZYsUo712",47613,47748
397,.@HillaryClinton is the best choice for president of the United States: https://t.co/PhRr4uzByZ https://t.co/9884WcdFhP,47749,47868
398,"At the 1988 Olympic games, Jackie Joyner-Kersee became the first woman to win gold in the long jump for @TeamUSA. https://t.co/SM21RY7QWn",47869,48006
399,Let’s make sure it does on Election Day → https://t.co/iWKBOE1i18 https://t.co/41ebkLl4pb,48007,48096
400,"Trump is running a cynical campaign of hate and fear, and he's got a new campaign chief to match. https://t.co/wSgKlxxebU",48097,48218
401,"Donald Trump just hired the head of an extreme, right-wing ""news"" organization to run his campaign. https://t.co/tswSCdkiBy",48219,48342
402,We can't let @realDonaldTrump become our next president. https://t.co/1zdOOMfync https://t.co/ZvUEIBDGMa,48343,48447
403,Trump boasts the support of some of the most extreme voices in politics. Now one of them runs his campaign: https://t.co/A6h02WDYfd,48448,48579
404,Hillary has concrete plans to help America succeed. Trump would...build a wall. https://t.co/9s8GSxmXdf https://t.co/UDnxd5Gh8z,48580,48707
405,"With just 83 days until Election Day, Trump hired one of the most extreme right-wing voices to run his campaign. https://t.co/geausYW6oD",48708,48844
406,"Trump’s new campaign chief is also the guy responsible for running this fringe ""news"" site: https://t.co/dH5lUyybYf",48845,48960
407,"Donald Trump is still the same man who insults Gold Star families, demeans women, and mocks people with disabilities.",48961,49078
408,The Trump Loophole would let millionaires cut their tax rates in half and do nothing for 99.8% of Americans. https://t.co/xmbflUy84w,49079,49211
409,The choice on jobs in this election (it’s not a hard one). https://t.co/C6X7yq9CQB https://t.co/nv4lJmUdsK,49212,49318
410,"If you do your job, you’re supposed to be rewarded for your work, not stiffed. https://t.co/un2YiRLEYF",49319,49421
411,"We’ve got to get the economy working for everybody, not just those at the top. Too many families are feeling financial stress.",49422,49548
412,Watch live: Hillary’s speaking in Cleveland about building an economy that works for everyone → https://t.co/EsqAmcnrnC,49549,49668
413,One candidate would help millions of hardworking Americans. The other would only help those at the top. https://t.co/qlnXNZiZmh,49669,49796
414,"Today, @Simone_Biles landed a spot in history as the first woman from @USAGym to win 4 golds. Well done, Simone! https://t.co/WldxYrC2ep",49797,49933
415,"If you were born between 1980 and 2002, Hillary has big plans to help you. https://t.co/4XCf0d3j7R",49934,50032
416,"Trump's idea for a new immigration test: ""Those who...support bigotry and hatred will not be admitted."" Awkward. https://t.co/LZoCq7U8NZ",50033,50169
417,Closely monitoring the flooding in Louisiana &amp; Mississippi. The @RedCross is helping displaced families in need: https://t.co/sSYTbQMndP -H,50170,50313
418,"""This man is totally, thoroughly unqualified to be president."" —@JoeBiden on @realDonaldTrump https://t.co/ZfFj9ZXsfD",50314,50431
419,"Last night, @allysonfelix won her 7th Olympic medal. Congrats to the most decorated woman in the history of @USATF! https://t.co/3LmdDx8iqn",50432,50571
420,"It’s not just that Trump doesn’t know what he’s talking about when it comes to national security. His words are dangerous, and they hurt us.",50572,50712
421,"Be a part of this: Get registered to vote, and ask everyone you know to register, too. https://t.co/tTgeqxNqYm",50713,50823
422,"“@TeamUSA is showing the world what this country stands for. I am proud of our team."" —Hillary in Philadelphia: https://t.co/byKmrx9XZy",50824,50959
423,"You should be able to learn a skill, practice a trade, and make a good living doing it. https://t.co/vNEHs6UJmo",50960,51071
424,"""By harnessing your energy and ideas, we can solve many of the problems we face."" — @HillaryClinton https://t.co/q90WpEBtO9",51072,51195
425,Trump's top adviser was designated $12.7 million from pro-Russia forces in Ukraine. That's the tip of the iceberg. https://t.co/4tYa2Y4nN9,51196,51334
426,Donald Trump says he'll create a new test for immigrants. It's a test he'd fail. https://t.co/LZoCq8bJFx,51335,51439
427,Both candidates have laid out economic plans. See how each would impact your state: https://t.co/BM2Fpk8lwA,51440,51547
428,Vice President @JoeBiden had the keys to our Instagram today. Check it out: https://t.co/N09gfgmFmN https://t.co/W6rlqb9C6N,51548,51671
429,"""The place of your birth should never be a barrier."" A letter to young undocumented people on DACA's anniversary: https://t.co/4dDrLvefeM",51672,51809
430,“He is a stunning ignoramus on foreign policy and national security.” https://t.co/h6NmEK07yB,51810,51903
431,The story of the Rodhams and the Bidens isn't unique. What's unique is the country where those stories were written. https://t.co/xUQW6ashqy,51904,52044
432,"On the fourth anniversary of #DACA, Juan remembers that ""glass ceiling-shattering moment""→ https://t.co/kt4nl4RQj0",52045,52159
433,We have some questions about Donald Trump's cozy relationship with Russia. https://t.co/N6ySNILYMx,52160,52258
434,"Whenever you hear Trump talk about foreign policy, picture him in the Situation Room making decisions for all of us. https://t.co/7QBVFziTdN",52259,52399
435,"You oppose reproductive rights, support ""conversion therapy,"" and proposed a Muslim ban. https://t.co/H04wanQIub",52400,52512
436,I bet Trump himself would fail his new immigration screening test of American values. #extremevetting https://t.co/JdxrGZkiXn,52513,52638
437,In case you needed a reminder that Donald Trump doesn’t know a thing about national security. https://t.co/1DA0d8j484,52639,52756
438,ICYMI: Donald Trump is against gay marriage. https://t.co/4XPeFxAolR,52757,52825
439,Trump's candidacy alone is undermining our national security. Imagine if he were to become president. https://t.co/OynjnrHsAj,52826,52951
440,"""It is never, never, never ever been a good bet to bet against the United States of America."" -VP Biden",52952,53055
441,"“She’s strong. She’s respected. She’s admired. There’s nothing that she doesn’t understand about America’s place in the world."" —@JoeBiden",53056,53194
442,"""It’s a recipe for playing into the hands of terrorists and their propaganda.” —@JoeBiden on Trump’s foreign policy rhetoric",53195,53319
443,"""Trump’s ideas are not only profoundly wrong, they’re dangerous and they’re very un-American.” —@JoeBiden https://t.co/tV4Cfp982z",53320,53449
444,"""Donald Trump has no clue what it takes to lead this great country.” —@JoeBiden",53450,53529
445,“This guy doesn’t care about the middle class...he doesn’t understand it. He doesn’t have a clue.” —@JoeBiden on Donald Trump,53530,53655
446,"“There’s only one person in this election who will...help you, and that is Hillary Clinton.” —@JoeBiden",53656,53759
447,"""Everyone is entitled to be treated with dignity and respect... and America can be defined in one single word — 'possibilities.'” -VP Biden",53760,53899
448,"""What Hillary’s all about is making sure every one of you…can look your child in the eye and say…everything is gonna be ok.” —@JoeBiden",53900,54035
449,"“No one is more worthy than you, and everyone is your equal.” —@JoeBiden",54036,54108
450,"""Home is where your character is stamped, where it’s stamped into your soul. Where your values are set.” —@JoeBiden",54109,54224
451,"“As Scranton has always had my back, we—all of us—are going to have your back, Hillary.” —@JoeBiden",54225,54324
452,Take out your phone and text JOIN to 47246. We’re hiring organizers right here in Pennsylvania and across the country.,54325,54443
453,There’s no doubt about it—Donald Trump is temperamentally unfit and totally unqualified to be president of the United States.,54444,54569
454,"""A man you can bait with a tweet is not a man you can trust with nuclear weapons.” —Hillary on @realDonaldTrump",54570,54681
455,"Trump says he won’t tell anyone what he’ll do about ISIS because he wants to keep his plan “secret.” Well, the secret is he has no plan.",54682,54818
456,Providing a “Trump Kids Club” for your paying customers is not the same thing as providing real child care for your workers.,54819,54943
457,"Under Trump's child care plan, hardworking families that can’t afford child care in the first place would get little to no real help.",54944,55077
458,"Trump wants to eliminate the Estate Tax. It would save the Trump family $4 billion, but it would do nothing for 99.8% of Americans.",55078,55209
459,Trump's called for a new tax loophole—the Trump Loophole. He'd pay less than half the current tax rate on income from many of his companies.,55210,55350
460,"Donald Trump would give trillions in tax cuts to big corporations, millionaires, and Wall Street money managers.",55351,55463
461,We’re going to make college debt-free for all and help millions of people struggling with existing student debt: https://t.co/l3h7YDCX3d,55464,55600
462,Under @POTUS and @JoeBiden: ✓ Our businesses created 15 million new jobs. ✓ 20 million people have health care. https://t.co/2SCUXK3VAP,55601,55736
463,"No matter what Donald Trump says, America is great, and the American Dream is big enough for everyone to share in its promise.",55737,55863
464,"""No matter where life takes me I always remember I am the granddaughter of a factory worker and the daughter of a small business owner.""",55864,56000
465,Joe is now leading a new Cancer Moonshot initiative to fund breakthroughs and save lives in honor of his son Beau. https://t.co/ofgoaD7t0V,56001,56139
466,Joe passionately believes in the basic bargain that makes America great—that our economy should work for everyone—not just those at the top.,56140,56280
467,"""No matter how far he travels, @JoeBiden never forgets where he’s from."" —Hillary in Scranton https://t.co/UnJ1zs3qXW",56281,56398
468,".@JoeBiden’s hitting the trail with Hillary in Scranton, folks. Tune in now: https://t.co/zFvHUT7UQ2 https://t.co/xbqUILQKGB",56399,56523
469,"Four years in, DACA has helped more than 700,000 undocumented people to live without fear. Let's build on it: https://t.co/Xw6IkKPSIQ",56524,56657
470,"If Donald Trump becomes president, he'll game America's whole tax system to make himself richer. Seriously. https://t.co/s82te3rlRP",56658,56789
471,"Trump says, ""I know more about ISIS than the generals do, believe me."" You know what? We don't. https://t.co/OynjnrpRbJ",56790,56909
472,The senseless murders of Imam Maulama Akonjee and Thara Uddin are heartbreaking. This kind of heinous act has no place in America. -H,56910,57043
473,No family should have to spend more than 10% of its income on quality child care. https://t.co/ReC2DZCjlM https://t.co/TFYDN6VYJj,57044,57173
474,"Yesterday, @ShotDiva made Olympic history with her gold medal in women's shot put (@TeamUSA's first!). https://t.co/ih1HYqnP8U",57174,57300
475,"Well said, Coach Auriemma. Keep winning, @USABasketball. https://t.co/1paG3IC51b",57301,57381
476,"59 million Americans get help from Social Security. On its 81st anniversary, let's recommit to protecting it. https://t.co/1YMaSX14VF",57382,57515
477,This is what @realDonaldTrump would do to your state's economy. https://t.co/t59VH8sa9e,57516,57603
478,"Farmers and ranchers are central to our economy, energy &amp; food security. Our plan to help: https://t.co/iv6kT3vumd https://t.co/WtSfCZEl95",57604,57746
479,The choice on jobs is pretty clear: See how your state would fare under Hillary vs. Trump. https://t.co/xIrmB63qg6,57747,57861
480,We need to make sure every American has high-speed internet access. And we will: https://t.co/jAszaFw1t3 https://t.co/fPOueqdTba,57862,57990
481,Press play for a preview of the new campaign podcast With Her. Stream the full episode here: https://t.co/3B2EmK8eDc https://t.co/G6TVuRAgIO,57991,58131
482,"As track and field begins, we're honoring Wilma Rudolph: the first U.S. woman to win 3 track golds in one Olympics. https://t.co/HW10MpbVuR",58132,58271
483,"Just released my tax returns, @realDonaldTrump. Where are yours? https://t.co/PgQ6XIGTqg",58272,58360
484,Many people are saying Trump won't release his tax returns because he's hiding something. What do you think it is?,58361,58475
485,Wonder what Trump's hiding in his tax returns? Tap through the reel to see some of the best guesses! https://t.co/XARmiDXAI9,58476,58600
486,LGBT kids are perfect the way they are. They deserve love and acceptance—not bullying and violence. https://t.co/RXcjvISf3O,58601,58724
487,RT if you agree: Every student should learn computer science. https://t.co/IzFbWB4I1I,58725,58810
488,"""We cannot succeed when half of us are held back. Education is the only solution.""—Malala #YouthDay https://t.co/v4E47uT4UM",58811,58934
489,"Last night, U.S. Olympic swimmer @Simone_Manuel won gold and made history. https://t.co/fShTxbpX2x",58935,59033
490,Housing discrimination cuts right to the heart of who we are as a society. We need to do all we can to fight it: https://t.co/RcNveGGwZM,59034,59170
491,Here's a pretty incredible fact: There is a non-zero chance that Donald Trump isn't paying *any* taxes. https://t.co/Aefxj6CKCd,59171,59298
492,Here's why Donald Trump might be refusing to release his tax returns: https://t.co/M4MSBonNyo,59299,59392
493,You can also listen to the first episode of With Her by streaming here: https://t.co/BVmjS8MFWn,59393,59488
494,I'm doing a new podcast that will run through Election Day and @hillaryclinton is my co-host https://t.co/FhBROuw0zy,59489,59605
495,"🎧 Just launched: With Her, our official campaign podcast. Subscribe and listen to Episode 1: https://t.co/IIzDVOt3r4",59606,59722
496,Why is @realDonaldTrump refusing to release his tax returns? Some ideas: https://t.co/M4MSBo6c9O,59723,59819
497,".@TeamUSA at the White House, circa 2000. #TBT https://t.co/cix9dny7PU",59820,59890
498,"Congrats on bringing home the gold and silver, Simone and Aly. We’re all so proud of you! -H https://t.co/oqYrHXmZTH",59891,60007
499,Trump wants America to work for him and his friends. We need to build an economy that works for everyone. https://t.co/p0bpzITUpv,60008,60137
