,sentence,start,end
189,"""We are building a wall. He's a Mexican!” —Donald Trump, June 3, 2016 https://t.co/uSSd7XigYp",22674,22767
190,"As Trump meets with President Peña Nieto, a helpful refresher on some of the things he’s said about Mexico: https://t.co/AltRQdTtGt",22768,22899
191,"When Trump talks about his mass deportation plan, he's talking about breaking up families like Karla's. https://t.co/MMDB4VFdCC",22900,23027
192,"In America, our shared values make us stronger. We can't let Trump tear down everything we stand for. https://t.co/pkiw5hdIGe",23028,23153
193,"""They have to go."" Trump has been perfectly clear about his intentions for millions of immigrants. https://t.co/kZ6hdDWrFt",23154,23276
194,"Our veterans deserve our thanks. You deserve a country that honors your service, not just with words but with deeds. https://t.co/Hi5VK3rrlJ",23277,23417
195,50 GOP national security experts said they will not vote for Trump because he would be “the most reckless president in American history.”,23418,23555
196,Too many veterans and their families aren’t getting the mental health services they need. Our plan to fix that: https://t.co/sb8i2wu8wt,23556,23691
197,"""I will never, ever disrespect Gold Star families who’ve made the ultimate sacrifice for our nation or prisoners of war.” —Hillary",23692,23822
198,The last thing we need is a president who brings more name-calling and temper tantrums to Washington.,23823,23924
199,"""I completely reject anyone, including my opponent, who calls the American military a 'disaster.'"" —Hillary to the @AmericanLegion",23925,24055
200,We can’t cozy up to dictators; we have to stand up to them. We can’t contain ISIS; we must defeat it. And we will.,24056,24170
201,"Getting countries to work together takes more than trying to make up for a year of insults by dropping in for a few hours, then flying home.",24171,24311
202,"American leadership means standing with our allies, because our network of allies is part of what makes us exceptional.",24312,24431
203,"“No matter how great the challenge, America must lead.” —Hillary to the @AmericanLegion https://t.co/byKmrx9XZy",24432,24543
204,".@GovChristie, vetoing a minimum wage increase is a blow to working families. No one who works full-time should have to live in poverty. -H",24544,24683
205,We're still 2.5 million away from reaching our August fundraising goal. Chip in by midnight and get a free sticker: https://t.co/wa1BxN66Ol,24684,24823
206,RT this if you agree. https://t.co/32mjc23tME,24824,24869
207,"A big, beautiful list of literally every tweet Donald Trump has sent about Mexico over the last two years. https://t.co/WCKL7oNdpg",24870,25000
208,"""From the first days of his campaign, Donald Trump has painted Mexicans as 'rapists' and criminals."" https://t.co/kwu8TJynrM",25001,25125
209,"What you need to know about the ""alt-right"" and @realDonaldTrump's connections to white supremacy and hate groups: https://t.co/JfQLDRP8dZ",25126,25264
210,"It’s time to come clean, Donald. Release your tax returns. Explain your business interests. https://t.co/HnHkt4BaGa https://t.co/eC3dIDr9v8",25265,25404
211,"Trump loves his ""Make America Great Again"" hat a lot for a guy who outsourced jobs to 12 different countries. https://t.co/5MZTsOgYR9",25405,25538
212,Trump's plan: 1. Round up and deport every single undocumented immigrant 2. Build a concrete wall An alternative: https://t.co/RCou5SMZPI,25539,25676
213,60% of adults experiencing mental health illnesses are untreated. It's time to close the treatment gap. https://t.co/9QIUUpOd26,25677,25804
214,Eight reasons why you shouldn't need a four-year degree to have a successful career: https://t.co/QhJE8VdLWT,25805,25913
215,The @ClintonFdn is saving lives around the world. https://t.co/jxl9vQ68lk,25914,25987
216,"Universal broadband, 5G wireless, CS Ed for all, open internet-- all in @HillaryClinton's ""wonkiest ever"" tech plan. https://t.co/pGEtzMYPtJ",25988,26128
217,Mike Pence’s governorship has been devastating to Indiana women. Just ask one of them: https://t.co/nu0DSiPQNf,26129,26239
218,We're facing the highest suicide rate in 30 years. Let's make sure every family can access mental health treatment. https://t.co/wg0K9WXWuD,26240,26379
219,Give the Trump family a huge tax cut or take care of our veterans? Not a hard choice. https://t.co/en3lDEN7ME https://t.co/CP4pEz14ln,26380,26513
220,Big victory from the @NLRB for workers' right to organize for fair wages and benefits. https://t.co/GKkVTWm6S6 https://t.co/VfXv3kTGBC,26514,26648
221,It's time to finally put access to care for mental health on par with physical health. https://t.co/SgMYIpi1Ac,26649,26759
222,The choice in November: a president with real plans to combat climate change—or one who calls it a hoax. https://t.co/tc5AokipbC,26760,26888
223,"Clinton today released a “sweeping agenda” to address America’s mental health problem, per @NickGass. https://t.co/t2ypVgeyfd",26889,27014
224,Hillary Clinton proposes plan to address mental health treatment https://t.co/C7BLynIroF https://t.co/CWhvxE6Cxm,27015,27127
225,Donald Trump: Make ________ Bangladesh China India Indonesia Vietnam Mexico Slovenia Great Again? https://t.co/5MZTsOgYR9,27128,27249
226,Qumber's parents came to this country for the American Dream. Trump is a threat to all they've achieved: https://t.co/YYXwtX2b4b,27250,27378
227,Too many Americans living with mental illness have been left to face it on their own. https://t.co/KyCFVylvB8 https://t.co/rayf9ADJKl,27379,27512
228,Joe and Hillary went home to Scranton. Take a behind-the-scenes look at their visit: https://t.co/xdiqa0dbdP,27513,27621
229,&gt;&gt; Trump Keeps Lying About Crime In America. This Is The Truth. https://t.co/SwsAZqsFZY,27622,27715
230,Trump talks about enacting extreme policy ideas that hurt Americans. His VP pick has actually done it. https://t.co/q3p5XFENI5,27716,27842
231,"Mi México, and the world, lost a great singer, songwriter and human being. #RIP #JuanGabriel. #DivoDeJuarez https://t.co/EkZ7eduRfA",27843,27974
232,"Charity Watch called the @ClintonFdn ""one of the great humanitarian charities of our generation."" https://t.co/YqAIhcmI2P",27975,28096
233,"Back when she was New York's senator, @HillaryClinton fought political attacks on access to emergency contraception: https://t.co/YEhvJjyQBP",28097,28237
234,Dear Donald: You can't make America great again when you don't make things in America. https://t.co/5MZTsOyzIH,28238,28348
235,We have some questions about this letter from Donald Trump's doctor. https://t.co/0wd7ZSAUxw,28349,28441
236,"Trump's housing company would mark black renters' applications with a ""C"" for ""colored""—then reject them. https://t.co/HzOwQNrnKi",28442,28571
237,"""The right to vote is still the most powerful nonviolent tool of transformation we have."" —@RepJohnLewis https://t.co/l0cGUBNlOK",28572,28700
238,"53 years ago today, we Marched on Washington for Jobs and Freedom. #GoodTrouble https://t.co/KO3YzpjuZG",28701,28804
239,We're stronger together—and the diversity of our athletes in Rio proved it. https://t.co/YYflz51Y9Y,28805,28904
240,"When Trump was starting in business, he was sued by the Justice Department for refusing to rent to black tenants. https://t.co/k3Ga8jvHSu",28905,29042
241,"53 years ago, Dr. King told us his dream. Today, let's recommit ourselves to the march toward equality for all. https://t.co/YNicCxIZrU -H",29043,29181
242,Hillary's small business plan: ✓ cut paperwork ✓ improve funding access ✓ save businesses $ https://t.co/9qnsPZ5JXZ https://t.co/fi4rGU5oAZ,29182,29321
243,Hate is not welcome in our homes. We shouldn't welcome it into the White House. #StrongerTogether https://t.co/B3sK5KpiQ4,29322,29443
244,Families across America are feeling the strain from prescription drug price-gouging. Here's how we'll take this on: https://t.co/FOTswQ6lXT,29444,29583
245,A must read today: The NYT digs deep into Donald Trump and his father's history of denying housing to blacks. https://t.co/c5GxvRQkQJ,29584,29717
246,"If Trump doesn’t see all Americans or respect all Americans, how can he serve all Americans? #StrongerTogether https://t.co/SDvVDRhC0e",29718,29852
247,Helping small businesses succeed is about more than policy—it's personal. https://t.co/mHmnin9sOR https://t.co/x0HTkkomBQ,29853,29974
248,You can learn a lot about a person by the company they keep. Here's some of the company Trump keeps: https://t.co/1CjVayZG54,29975,30099
249,It's Women's Equality Day. Donald Trump can't say he treats women with respect https://t.co/Rq8TFnXNev,30100,30202
250,Happy National Dog Day! https://t.co/qmpQsNQxGL,30203,30250
251,Making it easier to live the American Dream means making it easier to start and grow a small business. https://t.co/mOSa1W5Pyl,30251,30377
252,"Daughter, business owner, and immigrant: Meet Luisa—chaser of the American Dream. https://t.co/yhGwROb937",30378,30483
253,Happy #WomensEqualityDay from @realDonaldTrump. https://t.co/YfUdtygL4h,30484,30555
254,So what has the @ClintonFdn been up to? Helping millions of people get more affordable medicine to treat HIV/AIDS. https://t.co/fhwF7iKUXp,30556,30694
255,"Nearly 100 years ago, women broke down barriers to the ballot box, moving us closer to a more equal nation. Let's finish what they started.",30695,30834
256,"""human rights are women’s rights &amp; women’s rights are human rights."" - @HillaryClinton #WomensEqualityDay 👸🏽👸🏿👸🏻👸🏾👸🏼 https://t.co/gxD9wF8iwt",30835,30979
257,"Yes, @realDonaldTrump really did say all of these hateful things. https://t.co/gEvIU8Ugmc",30980,31069
258,"On #WomensEqualityDay, celebrate your right to vote by making sure you're ready to exercise it: https://t.co/oQJdlV15S2",31070,31189
259,"Even as we celebrate the 19th Amendment, remember the struggle for voting rights continued for women of color. That fight continues today.",31190,31328
260,"On this day in 1920, the 19th Amendment was adopted and many women won the right to vote. Let's break more ceilings. https://t.co/AGskZ5jhfK",31329,31469
261,We've made our union more perfect because people refused to be kept on the sidelines. Onward. #WomensEqualityDay https://t.co/QugGOqb2yl,31470,31606
262,"Countless women fought to win the right to vote. On the anniversary of the 19th Amendment's adoption, let's recommit to protecting it. -H",31607,31744
263,".@HillaryClinton: From the start, Trump has built his campaign on prejudice and paranoia https://t.co/7iAKFenZLo",31745,31857
264,Republican leaders should take a look at who they're standing with. https://t.co/1sXhWgXx02,31858,31949
265,Donald Trump’s campaign of prejudice and paranoia is unlike anything we’ve seen—and it’s profoundly dangerous. https://t.co/av4EtesW6l,31950,32084
266,Trump's bigoted rhetoric and policy proposals aren't a dog whistle. We hear him loud and clear. https://t.co/fPLy9wtTrM,32085,32204
267,Enjoying a quiet moment at @GrandTetonNPS back in 1995. Happy #NPS100! https://t.co/of8cMaj8mR,32205,32299
268,It's not a coincidence that white supremacists proudly support Trump. https://t.co/3OX4I1GSkr,32300,32393
269,Trump asked what the African American community has to lose by voting for him. @MarlonDMarshall's response: https://t.co/ZJtX7d49bM,32394,32525
270,"@Lesdoggg, no one deserves this—least of all someone who brings us so much joy. I'm with you. -H",32526,32622
271,"Trump says he wants to ""make America great again,"" but his real message remains “make America hate again.” https://t.co/7u3h7PSIXZ",32623,32753
272,"Let this sink in. To hate groups, Trump's language doesn't come across as coded. https://t.co/oHFFVRgGG5",32754,32858
273,"This election is too important for anyone to sit out. Text JOIN to 47246 or go to https://t.co/L7Dd6Uu8yR. Let’s go win this, together.",32859,32994
274,"Our rising generation of young Americans is the most open, diverse, and connected we’ve ever seen.",32995,33093
275,"""Every day, more Americans are standing up and saying 'enough is enough'—including a lot of Republicans. I’m honored to have their support.""",33094,33234
276,"In 2008, John McCain told his own supporters that Barack Obama is an American citizen and ""a decent person.""",33235,33343
277,"The week after 9/11, George W. Bush went to a mosque and declared for everyone to hear that Muslims 'love America just as much as I do.'",33344,33480
278,"20 years ago, when Bob Dole accepted the Republican nomination, he pointed to the exits and told any racists in the Party to get out.",33481,33614
279,"There’s an old Mexican proverb that says “Tell me with whom you walk, and I will tell you who you are.” We know who Trump is.",33615,33740
280,A fringe element has effectively taken over Trump’s campaign and the Republican Party. https://t.co/vJNBtpjpde,33741,33851
281,"Trump hired the head of Breitbart ""News"" to be CEO of his campaign. Here's a sample of their work: https://t.co/y8loOnkbNu",33852,33974
282,"Trump likes to say he only hires the ""best people,"" but he’s had to fire so many campaign managers it’s like an episode of the Apprentice.",33975,34113
283,"Trump would ban every Muslim around the world—1.5 billion men, women, and children—from entering the U.S. just because of their religion.",34114,34251
284,"Trump would abolish this bedrock constitutional principle: if you’re born in the U.S., you’re an American citizen. https://t.co/JYJqHhMjsK",34252,34390
285,Trump would form an armed deportation force to round up millions of immigrants and kick them out of the country. https://t.co/UNOvmzzaDO,34391,34527
286,Look at the policies Trump has proposed—they would put prejudice into practice. https://t.co/2AJqkb8JUs,34528,34631
287,Donald Trump is temperamentally unfit to be president of the United States.,34632,34707
288,Someone as detached from reality as Donald Trump should never be in charge of making decisions that are as real as they come.,34708,34833
289,Trump suggested that Ted Cruz’s father was involved in the Kennedy assassination. Of course there’s absolutely no evidence of that.,34834,34965
290,Trump claimed that thousands of American Muslims in New Jersey cheered the 9/11 attacks. They didn’t. https://t.co/mrFBlDza6y,34966,35091
291,"When Donald Trump was asked about anti-Semitic slurs and death threats coming from his supporters, he refused to condemn them.",35092,35218
292,"Trump refused to disavow the support of David Duke, a notorious former leader of the Ku Klux Klan. https://t.co/PD8bNwuS3c",35219,35341
293,Trump famously posted an anti-Semitic graphic that first appeared on a white supremacist website. https://t.co/JgH87OylQC,35342,35463
294,Trump retweets white supremacists. He took a fringe bigot and spread his message to 11 million people. https://t.co/dEv9EdvXtJ,35464,35590
295,"If Donald Trump doesn’t respect all Americans, how can he serve all Americans? https://t.co/Sp8nKxlocd",35591,35693
296,"In 2015, Trump launched his own campaign for president by describing Mexican immigrants as rapists and criminals. https://t.co/uSSd7XigYp",35694,35831
297,Trump first gained political prominence promoting the racist lie that President Obama isn’t really an American. https://t.co/WPM1I9PPN3,35832,35967
298,State regulators fined one of Trump’s casinos for repeatedly removing black dealers from the floor.,35968,36067
299,"When Trump was getting his start in business, he was sued by the Justice Dept. for refusing to rent apartments to black and Latino tenants.",36068,36207
300,Trump is reinforcing harmful stereotypes and offering a dog whistle to his most hateful supporters.,36208,36307
301,Donald Trump has built his campaign on prejudice and paranoia. He’s taking hate groups mainstream.,36308,36406
302,"""Everywhere I go, people tell me how concerned they are by the divisive rhetoric coming from my opponent in this election."" —Hillary",36407,36539
303,Live from Reno: Hillary discusses why @realDonaldTrump's divisive rhetoric is so dangerous to our future → https://t.co/ha9uCsizby,36540,36670
304,Longtime Ku Klux Klan leader David Duke supports Donald Trump because they share so many of the same values. https://t.co/XuXznBEslA,36671,36803
305,America has a lot to lose by electing Trump. But there’s one group in particular who has everything to gain. https://t.co/A6DFHnMOjd,36804,36936
306,"Why do so many Ku Klux Klan members support Trump? ""A lot of what he believes, we believe in."" https://t.co/AqB3DLKL9f",36937,37055
307,Thank you to the Orlando Health and Florida Hospital for showing empathy and kindness in the face of hate. -H https://t.co/2RODu7Y5bn,37056,37189
308,There's a reason the most hateful fringe of the right wing is supporting Donald Trump. https://t.co/AqB3DM2m0N,37190,37300
309,America's best idea 100 years ago is still our best idea today. Happy birthday to the @NatlParkService. #NPS100 https://t.co/0u7krunyLl,37301,37436
310,"""He is taking a hate movement mainstream. He has brought it into his campaign."" —Hillary to @andersoncooper on Trump",37437,37553
311,What's your volunteer personality type? Take our quiz for personalized recommendations on how to help elect Hillary: https://t.co/c09Vh2rnFd,37554,37694
312,8 things you can do *today* to help elect Hillary: https://t.co/fFpvl62RMB,37695,37769
313,FACT: The @ClintonFdn helps 11.5 million people with HIV/AIDS worldwide get their medication. https://t.co/wMAHC4u5RB,37770,37887
314,.@hillaryclinton announced a new public health fund to fight pandemics like Zika and keep American families safe https://t.co/RGXoMAkLmr,37888,38024
315,Thinking about the people of both Italy and Myanmar as they respond to today's earthquakes. My heart goes out to the victims’ families. -H,38025,38163
316,Indiana organizer Hillary Rodham in 1976. Join her team: https://t.co/lJ4B5ZA92K https://t.co/cKu4LUhwzQ,38164,38268
317,"Before @ClintinFdn, 200K people with HIV AIDS in poor countries got lifesaving anti-retroviral meds. Because of @ClintonFdn, 11.5M do now.",38269,38407
318,EpiPens can be the difference between life and death. There's no justification for these price hikes. https://t.co/O6RbVR6Qim -H,38408,38536
319,A message from Hillary to young women everywhere: https://t.co/6xfdyQ3H4Y https://t.co/eEOcd3VsXi,38537,38634
320,"It's HFA Volunteer Day, and we're looking for 50,000 volunteers. Help us get there—find your friends on Facebook: https://t.co/ggUNnLHE4B",38635,38772
321,We're going to fight for the ACA so kids like Jude aren't ever turned away because of a pre-existing condition. https://t.co/63ObIFmp84,38773,38908
322,"""No matter how daunting the odds, she never—ever—quits. That is the Hillary I know."" —@POTUS https://t.co/2EpcMtnTXR",38909,39025
323,Look WHO DID come over for lunch... Wow. #ImWithHer https://t.co/1pX4V4mUxq,39026,39101
324,"Why would we give Trump's family a $4 billion tax cut when we could use that money to fix 8,000 bridges? https://t.co/fwD8O8o7eS",39102,39230
325,"This fall, USPS will honor joyous Hindu Festival of #Diwali with a Forever® stamp! https://t.co/ahplXrlp5s https://t.co/XadduwKYok",39231,39361
326,The gender wage gap is even wider for women of color. It's time to ensure equal pay. #BlackWomensEqualPay https://t.co/CLRq4Qq4iZ,39362,39491
327,David Duke’s show cheers Trump-Breitbart merger: “We appear to have taken over the Republican Party” https://t.co/uKQglNdX8b via @Salon,39492,39627
328,Disappointed that split 6th Cir. (2-1) OVERTURNED restoration of Golden Week. Bad for voters. Bad for voting rights. https://t.co/nQgtTZZZJZ,39628,39768
329,"""What I want the people of Louisiana to know is this—you’re not alone.""—@POTUS in Baton Rouge: https://t.co/6Uet2HpPXI #LAflood",39769,39896
330,Small businesses are the backbone of our economy. We should focus on supporting them—not stiffing them. https://t.co/mHmnin9sOR,39897,40024
331,"Escuchamos claramente los comentarios de Trump demonizando a los inmigrantes la primera vez, la segunda, tercera... https://t.co/MYRDyXxzvq",40025,40164
332,"On average, it takes black women until today to catch up to white men's 2015 earnings. Time to close the pay gap. https://t.co/5eYBD4Y7Mr",40165,40302
333,"When it comes to #smallbiz, it's personal for @HillaryClinton. Lessons from her dad help inspire plan: https://t.co/2sCxRgkKdU",40303,40429
334,"We heard Trump's demonizing comments on immigrants loud and clear the first time. And the second, third, fourth ... https://t.co/uSSd7X0FzP",40430,40569
335,"Tune in to watch Hillary on @JimmyKimmelLive, 11:35 ET/10:35 CT. https://t.co/drQevoF879",40570,40658
336,Donald Trump's economic plan is rigged so rich people like him get tax cuts at the expense of everybody else. https://t.co/D0oOe5TVHC,40659,40792
337,"You can't have the best military unless folks pay their fair share in taxes, Donald. https://t.co/zfwqXwNLJj",40793,40901
338,"Have a beer with @TimKaine in the second episode of With Her, the official campaign podcast. Listen here: https://t.co/3B2EmKpQ1M",40902,41031
339,The stories behind some of the history-making women of @TeamUSA. https://t.co/S61LuCyMje https://t.co/dybz3cAJsg,41032,41144
340,"“If I have the opportunity, I’ll do whatever I can to make things a little easier for you."" —Hillary to young women https://t.co/6xfdyQ3H4Y",41145,41284
341,"Cheryl lost her husband in Iraq. Then Trump's company targeted her and scammed her out of $35,000. https://t.co/Wjz6zohMIT",41285,41407
342,"In times of crisis, America depends on steady leadership, clear thinking, and calm judgment. https://t.co/Tpo3Sp7Ri1",41408,41524
343,Read more of @HillaryClinton's message to young women here: https://t.co/HSlUR8bI6n https://t.co/awSbJQzkC6,41525,41632
344,Michigan is on the front lines of a manufacturing renaissance. Hillary saw it herself at Futuramics in Warren. https://t.co/Nv04llcNca,41633,41767
345,"Trump's new ""King of Debt"" tax shelter means negative tax rates - meaning taxpayers pay him for high-debt projects: https://t.co/6K5zeQeVAX",41768,41907
346,".@TimKaine takes the mic in the latest episode of With Her, the official campaign podcast. Subscribe &amp; listen here: https://t.co/IIzDVOt3r4",41908,42051
347,One wrong move can be the difference between life and death when you're president. https://t.co/Tpo3Spps9z,42052,42158
348,The best way to help Louisianans affected by terrible flooding is to make sure they have the resources they need: https://t.co/lVjQXLZnV8,42159,42296
349,"""Everything I say I'm going to do, folks, I do."" —@realDonaldTrump Here's why that's a disaster for our economy: https://t.co/KYzPrHnMHv",42297,42433
350,"This week, Donald Trump made a shockingly ignorant pitch to African American voters. https://t.co/acxeolbsuv",42434,42542
351,"“Her mastery of issues and detail is unlike any politician I’ve met."" —@WIRED's editor-in-chief on Hillary https://t.co/GcA4lJiLbb",42543,42673
352,Hillary met with Miami doctors to discuss the public health challenge of treating and preventing Zika. https://t.co/kYPvsWiMDq,42674,42800
353,Donald Trump claims he surrounds himself with the greatest people. Check out his choice for campaign chief. https://t.co/qSE0RPotCV,42801,42932
354,"Congrats to Flint, Michigan's @ClaressaShields on her second Olympic gold medal for @TeamUSA. https://t.co/u2RA7GoDiy",42933,43050
355,Donald Trump’s new message to African American voters isn’t just inaccurate. It’s outrageous. https://t.co/gozfbXa6Uw,43051,43168
356,"If you were president, how would you spend $4 billion? (One guess as to Trump's answer: https://t.co/9wj6zlbB7j)",43169,43281
357,There is so much more that unites us than divides us. That's why we're the greatest country on Earth. https://t.co/6uZVP0tjK9,43282,43407
358,This lifelong Republican wrote a letter to his daughter about why he's voting for Hillary this November: https://t.co/iqmnZaR7xN,43408,43536
359,"It's too late now to say sorry, Donald. https://t.co/TWj7QwEfVh",43537,43600
360,"If you dream it, you should be able to build it. https://t.co/uArcPunfFy https://t.co/qKg0MOHVBv",43601,43697
361,This choice is pretty straightforward. https://t.co/8D3Og1UM14 https://t.co/1pbwefsVLy,43698,43784
362,Donald Trump has shown us who he is. We should believe him. https://t.co/TWj7QwEfVh,43785,43868
363,Trump’s tax plan could give his own family a $4 billion tax break. Here's what we could do with that money instead: https://t.co/89rNgjYcGk,43869,44008
364,"""We don't win anymore."" https://t.co/opLEssKAxA",44009,44056
365,Let's send Donald Trump a message in November: We're not going back. https://t.co/85ovKr3y2x,44057,44149
366,"""I don't regret anything."" —Donald Trump, August 2, 2016 https://t.co/TWj7QwVQMP",44150,44230
367,"This week, Donald Trump suddenly tried to claim that he has some ""regrets."" About that... https://t.co/6Igq6bOIZG",44231,44344
368,Trump says he hires the best people. This is what he means: https://t.co/FvCVcmLLCY,44345,44428
369,Trump painting the entire African American community as living in poverty with no jobs shows he's completely out of touch with us.,44429,44559
370,"Trump questions the citizenship of the first black president, courts white supremacists, and has been sued for housing discrimination.",44560,44694
371,Donald Trump asks what the African American community has to lose by voting for him. The answer: everything.,44695,44803
372,There are no words. https://t.co/xTSh2R1v6M,44804,44847
373,This is so ignorant it’s staggering. https://t.co/t2fZl9sqKs,44848,44908
374,"When the IOC introduced women's wrestling in 2004, @Helen_Maroulis dreamed of gold. Yesterday that dream came true. https://t.co/ZvyuQYK36v",44909,45048
375,"When bombs rain down, they rush in. Inspired by the White Helmets &amp; others helping those in need worldwide. #WHD https://t.co/sBZfH4COGJ",45049,45189
